Job_title,Job_role,Company,Job_location,Job_summary,Post_date,Today,Job_salary,Job_url
Data Scientist,Data Scientist,Capgemini,"Bengaluru, Karnataka","Proficient in data mining and data cleansing techniques.
Helping & Managing teams of data scientist and produce project deliverables.",PostedPosted 30+ days ago,2023-03-19,NaN,https://in.indeed.com/jobs?q=Data+Scientist&l=India&start=10
Data Scientist 1,Data Scientist,PayPal,"Bengaluru, Karnataka+1 location","2+ years of work experience in relevant positions (e.g. Decision scientist, data analyst, statistician, data scientist, FP&A, product/process manager, risk…",PostedPosted 8 days ago,2023-03-19,NaN,https://in.indeed.com/jobs?q=Data+Scientist&l=India&start=10
Technology Consultant - Data Scientist - Bangalore/Gurgaon - T2/T3,Data Scientist,SAP,Delhi,"Work closely with other data scientist and teams to enable transformation journey with customer.
We are looking for data scientist, you have strong expertise in…",PostedPosted 1 day ago,2023-03-19,NaN,https://in.indeed.com/jobs?q=Data+Scientist&l=India&start=10
"Specialist, Data Scientist",Data Scientist,The Bank of New York Mellon Corporation,"Pune, Maharashtra","Establishes relationships to obtain data and subject knowledge needed to support advanced analytics.
Stays abreast of organization and management changes and…",PostedPosted 2 days ago,2023-03-19,NaN,https://in.indeed.com/jobs?q=Data+Scientist&l=India&start=10
Data Scientist,Data Scientist,UBS,"Pune, Maharashtra",Effectively use data science toolkits and related visualization technologies to deliver quality analytics and data insight to our stakeholders.,PostedPosted 1 day ago,2023-03-19,NaN,https://in.indeed.com/jobs?q=Data+Scientist&l=India&start=10
Data Scientist,Data Scientist,Lenskart,"Gurgaon District, Haryana","Leverage customer chat data for applications in text analytics such as sentiment analysis, NPS prediction, topic modelling etc.",PostedPosted 30+ days ago,2023-03-19,NaN,https://in.indeed.com/jobs?q=Data+Scientist&l=India&start=10
Data Scientist,Data Scientist,Fortuna Entertainment Group,Hybrid remote in India,"Support the data analytics team in improving analytical models with data science-based insights.
Exciting sports and gaming data and latest technology.",PostedPosted 1 day ago,2023-03-19,NaN,https://in.indeed.com/jobs?q=Data+Scientist&l=India&start=10
Data Scientist-Python & Machine learning,Data Scientist,"JPMorgan Chase Bank, N.A.","Bengaluru, Karnataka",You will be part of Decision Sciences team that leverages industry-leading data-driven techniques to convert data into meaningful insights that enable the firm…,PostedPosted 1 day ago,2023-03-19,NaN,https://in.indeed.com/jobs?q=Data+Scientist&l=India&start=10
AI-ML Engineer,Data Scientist,Larsen & Toubro Limited,"Vadodara, Gujarat","Data gathering, data cleaning and data processing of historical data.
Understanding of data structure, data modeling and software architecture.",PostedPosted 11 days ago,2023-03-19,"₹8,00,000 - ₹12,00,000",https://in.indeed.com/jobs?q=Data+Scientist&l=India&start=10
Data Science Specialist,Data Scientist,Transorg Analytics,"Remote in Gurgaon District, Haryana","Should have sound experience in data mining and data analysis.
Must have a passion for data, structured or unstructured.",PostedPosted 30+ days ago,2023-03-19,NaN,https://in.indeed.com/jobs?q=Data+Scientist&l=India&start=10
Data Scientist,Data Scientist,Iris software,"Noida, Uttar Pradesh","Apply scientific data collection and interpretation activities and ensure collected data is relevant and exhaustive.
Tech - Code quality and coding standards.",PostedPosted 3 days ago,2023-03-19,NaN,https://in.indeed.com/jobs?q=Data+Scientist&l=India&start=10
Data scientist,Data Scientist,ICICI Prudential Life,"Mumbai, Maharashtra","Data extraction using valuable data sources.
Perform initial investigation and exploratory data analysis.
Analyzing large amount of data to find patterns and…",PostedJust posted,2023-03-19,NaN,https://in.indeed.com/jobs?q=Data+Scientist&l=India&start=20
Data Scientist,Data Scientist,Faurecia,"Pune, Maharashtra","Research & Develop Machine Learning/AI algorithms to solve the engineering & Manufacturing problems.
Discover insights & develop prediction system for Finance &…",PostedPosted 19 days ago,2023-03-19,NaN,https://in.indeed.com/jobs?q=Data+Scientist&l=India&start=20
Data Science Online Trainer,Data Scientist,Prognoz,India,"1+ year experience in Data Science.
Must have worked on minimum 2 Data Science Projects and must have at least 50 hours experience in online training on Data…",PostedPosted 30+ days ago,2023-03-19,NaN,https://in.indeed.com/jobs?q=Data+Scientist&l=India&start=20
Analytics Data Engineer / Data Scientist,Data Scientist,COMPEGENCE,"Bengaluru, Karnataka","Ability to operationalise the data pipeline.
Operationalise 360 degree Analytical data feedback loop.
4 plus Customer Project experience handling large scale…",PostedPosted 30+ days ago,2023-03-19,"₹90,000 - ₹1,50,000 ",https://in.indeed.com/jobs?q=Data+Scientist&l=India&start=20
Machine Learning Intern,Data Scientist,SolarWinds,"Bengaluru, Karnataka","Analyzing data sets and extracting insights from them.
Building and testing ML models and algorithms on telemetry data.",PostedPosted 21 days ago,2023-03-19,NaN,https://in.indeed.com/jobs?q=Data+Scientist&l=India&start=20
Data scientist,Data Scientist,Vingsfire pvt ltd,"Remote in Hyderabad, Telangana","The course duration is 6 months....
You will be given high level knowledge and with paid intership....
Job Types: Full-time, Fresher.",EmployerActive 1 day ago,2023-03-19,"₹4,00,000 - ₹11,00,000",https://in.indeed.com/jobs?q=Data+Scientist&l=India&start=20
Data Scientist,Data Scientist,Airtel India,"Gurugram, Haryana+1 location","Incident management & Change management of around 400 NMS/EMS instances.
Major upgrades & Bug fixing of 400 NMS/EMS instances.",PostedPosted 30+ days ago,2023-03-19,NaN,https://in.indeed.com/jobs?q=Data+Scientist&l=India&start=20
Data Scientist,Data Scientist,Innobuzz Learning Solutions LLP,"Delhi, Delhi","2-5 years of experience in data science.
High proficiency in at least one of the following broad areas: machine learning, statistical modelling/inference,…",PostedPosted 2 days ago,2023-03-19,"₹3,00,000 - ₹6,00,000",https://in.indeed.com/jobs?q=Data+Scientist&l=India&start=20
Data Scientist,Data Scientist,Pridetech labs pvt ltd Bangalore,Remote,"Experience working with and creating data architectures.
Knowledge and experience in statistical and data mining techniques.",PostedPosted 30+ days ago,2023-03-19,"From ₹5,00,000",https://in.indeed.com/jobs?q=Data+Scientist&l=India&start=20
Data Scientist,Data Scientist,Aveon InfoTech PVT.LTD,"Delhi, Delhi","O Clean, aggregate, analyze, interpret data, and carry out quality analysis of it o Set up data warehouse for predictive/prescriptive analysis.",PostedPosted 16 days ago,2023-03-19,"Up to ₹30,00,000",https://in.indeed.com/jobs?q=Data+Scientist&l=India&start=20
Summer Intern: Data Science,Data Scientist,G2,"Bengaluru, Karnataka","The data science team creates features by collaborating with stakeholders, analyzing and building a variety of data science models, and promoting those models…",PostedPosted 1 day ago,2023-03-19,NaN,https://in.indeed.com/jobs?q=Data+Scientist&l=India&start=20
NLP - Machine Leaning Engineer,Data Scientist,Tapaya Technologies,Remote,"Looking for developers with experience in python and NLP.
Familiarity with ML algorithms , git and Linux environment preferred.",PostedPosted 14 days ago,2023-03-19,"Up to ₹18,000 ",https://in.indeed.com/jobs?q=Data+Scientist&l=India&start=20
Consulting - ET&P : F&P - Data Scientist - Sr. Consultant,Data Scientist,Deloitte,"Bengaluru, Karnataka","ob requisition ID :: 49923 Date: Mar 16, 2023 Location: Bengaluru Designation: Senior Consultant Entity: Deloitte Touche Tohmatsu India LLP Timeseries",PostedPosted 30+ days ago,2023-03-19,NaN,https://in.indeed.com/jobs?q=Data+Scientist&l=India&start=20
Data Scientist,Data Scientist,Harman International,"Bengaluru, Karnataka","Advance level understanding of programming concepts related to data science.
Data collection and analysis to understand the business requirement and map it to…",PostedPosted 30+ days ago,2023-03-19,NaN,https://in.indeed.com/jobs?q=Data+Scientist&l=India&start=20
Data Science Internship,Data Scientist,Oracuz Infotech Pvt Ltd,"Thiruvananthapuram, Kerala",Part-time hours: 40 per week.,EmployerActive 1 day ago,2023-03-19,NaN,https://in.indeed.com/jobs?q=Data+Scientist&l=India&start=20
Urgently hiring Associate Data Scientist,Data Scientist,Pinnacle Software and Services Pvt Ltd,"Thiruvananthapuram, Kerala","We aim to provide products for building better accounting and various other solutions.
Design and build an AI development and delivery pipeline, including…",PostedPosted 1 day ago,2023-03-19,"₹3,25,000 - ₹5,00,000",https://in.indeed.com/jobs?q=Data+Scientist&l=India&start=30
Computer Vision Research/ Platform Engineer - Machine Learning,Data Scientist,Mercedes-Benz Research and Development India...,"Bengaluru, Karnataka","Experience working with synthetic and artificial data to solve real world problems.
Experience with object classification, gesture recognition or human pose…",PostedPosted 30+ days ago,2023-03-19,NaN,https://in.indeed.com/jobs?q=Data+Scientist&l=India&start=30
Data Science Analytics,Data Scientist,Diverse Infotech,Delhi,ata Science Analytics Diverse Infotech Pvt. Ltd. - Gurgaon Required Experience - 2+,PostedPosted 17 days ago,2023-03-19,NaN,https://in.indeed.com/jobs?q=Data+Scientist&l=India&start=30
Data Scientist - Data Mining,Data Scientist,AHRC Pvt Ltd,"Noida, Uttar Pradesh","Data mining or extracting usable data from valuable data sources.
Present information using data visualization techniques.",PostedPosted 1 day ago,2023-03-19,"₹10,00,000 - ₹15,00,000",https://in.indeed.com/jobs?q=Data+Scientist&l=India&start=30
Data Science - Intern,Data Scientist,Ambee,"Bengaluru, Karnataka","We deal with a lot of data, including data pre-processing, writing intrinsic scripts, and automating pipelines.",PostedPosted 30+ days ago,2023-03-19,NaN,https://in.indeed.com/jobs?q=Data+Scientist&l=India&start=30
Data Scientist (India Remote),Data Scientist,Token Metrics,"Remote in Hyderabad, Telangana+1 location","Master’s degree in computational linguistics, data science, data analytics, or similar will be advantageous.
Developing ML algorithms to analyze huge volumes of…",PostedPosted 30+ days ago,2023-03-19,NaN,https://in.indeed.com/jobs?q=Data+Scientist&l=India&start=30
AI / Big Data Analyst (Powertrain applications) - COB,Data Scientist,Bosch Group,"Coimbatore, Tamil Nadu",Bachelor of Engineering (B.E / B.,PostedToday,2023-03-19,NaN,https://in.indeed.com/jobs?q=Data+Scientist&l=India&start=30
Data Scientist,Data Scientist,Société Générale,"Bengaluru, Karnataka","Min. 4 years experience as a Data Developer with hands on experience on Advanced Python, Pandas, Numpy, Scikit Learn, Scipy.",PostedPosted 30+ days ago,2023-03-19,NaN,https://in.indeed.com/jobs?q=Data+Scientist&l=India&start=30
Sr. Data Scientist,Data Scientist,OMS Software Solutions India Pvt Lltd,"Coimbatore, Tamil Nadu","Undertake preprocessing of structured and unstructured data.
Identify valuable data sources and automate collection processes.",EmployerActive 4 days ago,2023-03-19,"₹12,00,000 - ₹21,00,000",https://in.indeed.com/jobs?q=Data+Scientist&l=India&start=30
AVP - Data Scientist,Data Scientist,Barclays,"Delhi, Delhi","Prior work in a comparable organisation as a data scientist or in a technical analyst role.
Use Python to extract, transform and analyse various types of data.",PostedPosted 30+ days ago,2023-03-19,NaN,https://in.indeed.com/jobs?q=Data+Scientist&l=India&start=30
Data Scientist,Data Scientist,Razor Group GmbH,"New Delhi, Delhi","You developing quantitative models, leveraging machine learning and advanced data analysis techniques to.
You have strong experience in data analysis, writing…",PostedPosted 30+ days ago,2023-03-19,NaN,https://in.indeed.com/jobs?q=Data+Scientist&l=India&start=30
Applied Data Scientist,Data Scientist,dh internal Job Board,"Gurgaon District, Haryana","Statistical Modelling and experience of applying data science into client problems.
Using big data, deep expertise and AI-driven platforms to decode the 21st…",PostedPosted 2 days ago,2023-03-19,NaN,https://in.indeed.com/jobs?q=Data+Scientist&l=India&start=30
Deep Learning Engineers,Data Scientist,Conxai Technologies GmbH,"Bengaluru, Karnataka","With such an experience, the candidate will also be in a position to create cutting edge ""Neural Reasoning"" solutions to understand construction sites from…",PostedPosted 9 days ago,2023-03-19,"₹18,00,000 - ₹27,00,000",https://in.indeed.com/jobs?q=Data+Scientist&l=India&start=30
Junior Data Scientist/ta,Data Scientist,WSD Consultant,"Gurgaon District, Haryana","Qualification Other Bachelor Degree, MD/Medicinae Doctor, Other Doctorate Degree.
These programs are delivered through a convenient and robust technology…",PostedPosted 30+ days ago,2023-03-19,"₹7,00,000 - ₹15,00,000",https://in.indeed.com/jobs?q=Data+Scientist&l=India&start=30
Data Scientist,Data Scientist,Ericsson,"Noida, Uttar Pradesh","Lead and develop a team of data scientists and engineers.
Experience with big data analytics - identifying trends, patterns, and outliers in large volumes of…",PostedPosted 9 days ago,2023-03-19,NaN,https://in.indeed.com/jobs?q=Data+Scientist&l=India&start=30
Data Analytics Intern,Data Scientist,Ecozen Solutions,"Pune, Maharashtra","Analyze data of IoT devices to study performance and model the physical behavior of systems.
Experience: a minimum of 3 months of similar project experience in…",PostedPosted 23 days ago,2023-03-19,NaN,https://in.indeed.com/jobs?q=Data+Scientist&l=India&start=40
Associate- Data Scientist,Data Scientist,Bain & Company,"Gurugram, Haryana",Be part of the thought leadership exercise to establish a blue-print for cloud-based deployment of any analytical and/or data-driven solution.,PostedPosted 24 days ago,2023-03-19,NaN,https://in.indeed.com/jobs?q=Data+Scientist&l=India&start=40
Wobot.ai - Computer Vision Engineer,Data Scientist,Wobot.ai,Remote,"Work Actively as a part of the Computer Vision and Deep Learning Team to Train Computer Vision Models.
Work Closely with the Data Science Team for Appropriate…",EmployerActive 1 day ago,2023-03-19,"₹5,00,000 - ₹8,00,000",https://in.indeed.com/jobs?q=Data+Scientist&l=India&start=40
Data Scientist,Data Scientist,Clarifai,"Remote in Bengaluru, Karnataka","You will manage the development of labeled data sets.
This activity will raise the quality and number of models available in the Clarifai Platform.",PostedPosted 10 days ago,2023-03-19,NaN,https://in.indeed.com/jobs?q=Data+Scientist&l=India&start=40
Data Scientist,Data Scientist,DataEconomy,"Hyderabad, Telangana","Data mining or extracting usable data from valuable data sources.
Devise and utilize algorithms and models to mine big-data stores; perform data and error…",PostedPosted 1 day ago,2023-03-19,NaN,https://in.indeed.com/jobs?q=Data+Scientist&l=India&start=40
Analytics Analyst,Data Scientist,Deutsche Bank,"Jaipur, Rajasthan","Provide data and analytical support to Global Procurement prioritised change initiatives.
You attach great importance to details, ensure results are of high…",PostedPosted 24 days ago,2023-03-19,NaN,https://in.indeed.com/jobs?q=Data+Scientist&l=India&start=40
Data Scientist,Data Scientist,TaskUS,"Gurgaon District, Haryana",Should be able to leverage github to collaborate with other data scientists and use it as a source code repository to manage the work.,PostedPosted 14 days ago,2023-03-19,NaN,https://in.indeed.com/jobs?q=Data+Scientist&l=India&start=40
Sr. Data Scientist,Data Scientist,Golden Eagle,"Remote in Indore, Madhya Pradesh","Extensive experience as a data scientist.
Collating and cleaning data from various entities for later use by junior data scientists.",PostedPosted 5 days ago,2023-03-19,NaN,https://in.indeed.com/jobs?q=Data+Scientist&l=India&start=40
Junior Data Scientist-Operations Excellence,Data Scientist,Accenture,"Gurgaon District, Haryana","Years of Experience: 5 to 8 years.
You will be working as a part of Operations Excellence team which drives continuous improvement projects and interact with…",PostedPosted 15 days ago,2023-03-19,NaN,https://in.indeed.com/jobs?q=Data+Scientist&l=India&start=40
Data Scientist,Data Scientist,Luxoft,"Bengaluru, Karnataka","Provide Services that will support specific use cases for advanced analytics and data solutions, primarily focused on Fraud Management and Network Intelligence.",PostedPosted 1 day ago,2023-03-19,NaN,https://in.indeed.com/jobs?q=Data+Scientist&l=India&start=40
"Senior Specialist, Data Scientist",Data Scientist,The Bank of New York Mellon Corporation,"Pune, Maharashtra+1 location","Establishes relationships to obtain data and subject knowledge needed to support advanced analytics.
Accountable for developing and guiding more junior members…",PostedPosted 19 days ago,2023-03-19,NaN,https://in.indeed.com/jobs?q=Data+Scientist&l=India&start=40
Data Scientist,Data Scientist,Peak AI,"Pune, Maharashtra","Experience in one or some of - statistical modelling, machine learning, data mining, unstructured data analytics, natural language processing.",PostedPosted 16 days ago,2023-03-19,NaN,https://in.indeed.com/jobs?q=Data+Scientist&l=India&start=40
Data Scientist,Data Scientist,Stock Holding,"Navi Mumbai, Maharashtra","Strong mathematical skills to collect, measure, organize and analyze data.
Need to work on various datasets, data massaging, apply statistical analytical,…",PostedToday,2023-03-19,NaN,https://in.indeed.com/jobs?q=Data+Scientist&l=India&start=40
Data Scientist- AML/Fin Crime - Mumbai,Data Scientist,EY,"Mumbai, Maharashtra","It is done through a transformative and agile approach including process and procedures, risk, data modeling and analytics, reporting to stakeholders and third…",PostedPosted 10 days ago,2023-03-19,NaN,https://in.indeed.com/jobs?q=Data+Scientist&l=India&start=40
Data Scientist,Data Scientist,Hewlett Packard Enterprise,"Bengaluru, Karnataka",Ability to translate business requirements into mathematical models and data science objectives to achieve measurable business outcomes.,PostedPosted 26 days ago,2023-03-19,NaN,https://in.indeed.com/jobs?q=Data+Scientist&l=India&start=40
Data Scientist- AML/Fin Crime - Mumbai,Data Scientist,EY,"Mumbai, Maharashtra","It is done through a transformative and agile approach including process and procedures, risk, data modeling and analytics, reporting to stakeholders and third…",PostedPosted 10 days ago,2023-03-19,NaN,https://in.indeed.com/jobs?q=Data+Scientist&l=India&start=50
Data Scientist,Data Scientist,EVRY India,"Bengaluru, Karnataka","Using innovative ideas to collect, curate or synthesize data.
Bachelor's / master’s in data science with 2 years’ experience OR in Statistics/Mathematics with…",PostedPosted 2 days ago,2023-03-19,NaN,https://in.indeed.com/jobs?q=Data+Scientist&l=India&start=50
Data Scientist,Data Scientist,Stock Holding,"Navi Mumbai, Maharashtra","Strong mathematical skills to collect, measure, organize and analyze data.
Need to work on various datasets, data massaging, apply statistical analytical,…",PostedToday,2023-03-19,NaN,https://in.indeed.com/jobs?q=Data+Scientist&l=India&start=50
Data Scientist/ Analyst - T9,Data Scientist,Mercedes-Benz Research and Development India...,"Bengaluru, Karnataka","This data is further analysed and the performance of the ADAS systems are monitored.
Architecting, developing and deploying end to end pipeline to ingest…",PostedPosted 30+ days ago,2023-03-19,NaN,https://in.indeed.com/jobs?q=Data+Scientist&l=India&start=50
Analytics & Data Science,Data Scientist,Kpro Solutions,"Bengaluru, Karnataka","The candidate should be good in python,sql and data structure.
Proficiency in using SQL, Hadoop/Spark for data extraction and analysis.",PostedPosted 30+ days ago,2023-03-19,NaN,https://in.indeed.com/jobs?q=Data+Scientist&l=India&start=50
Data Scientist,Data Scientist,Industry.AI,"Bengaluru, Karnataka","Strong Python skills for data wrangling / analysis / visualization / modelingExperience with distributed big data processing (PySpark, Jupyter, Linux, AWS…",PostedPosted 30+ days ago,2023-03-19,NaN,https://in.indeed.com/jobs?q=Data+Scientist&l=India&start=50
Sr. Data Scientist,Data Scientist,Golden Eagle,"Remote in Indore, Madhya Pradesh","Extensive experience as a data scientist.
Collating and cleaning data from various entities for later use by junior data scientists.",PostedPosted 5 days ago,2023-03-19,NaN,https://in.indeed.com/jobs?q=Data+Scientist&l=India&start=50
Analytics Analyst,Data Scientist,Deutsche Bank,"Jaipur, Rajasthan","Provide data and analytical support to Global Procurement prioritised change initiatives.
You attach great importance to details, ensure results are of high…",PostedPosted 24 days ago,2023-03-19,NaN,https://in.indeed.com/jobs?q=Data+Scientist&l=India&start=50
Data Scientist,Data Scientist,Hewlett Packard Enterprise,"Bengaluru, Karnataka",Ability to translate business requirements into mathematical models and data science objectives to achieve measurable business outcomes.,PostedPosted 26 days ago,2023-03-19,NaN,https://in.indeed.com/jobs?q=Data+Scientist&l=India&start=50
Data Science,Data Scientist,Globussoft Technologies,"Bengaluru, Karnataka","Develop custom data models and algorithms to apply to data sets.
Extending company’s data with third party sources of information when needed.",PostedPosted 30+ days ago,2023-03-19,"₹3,60,000",https://in.indeed.com/jobs?q=Data+Scientist&l=India&start=50
Data Scientist Consultant,Data Scientist,EY,"Bengaluru, Karnataka","Experience with data wrangling, cleansing, and data engineering for data science applications.
Experience applying a broad range of data science techniques.",PostedPosted 11 days ago,2023-03-19,NaN,https://in.indeed.com/jobs?q=Data+Scientist&l=India&start=50
Deep Learning Engineers,Data Scientist,Conxai Technologies GmbH,"Bengaluru, Karnataka","With such an experience, the candidate will also be in a position to create cutting edge ""Neural Reasoning"" solutions to understand construction sites from…",PostedPosted 9 days ago,2023-03-19,"₹18,00,000 - ₹27,00,000",https://in.indeed.com/jobs?q=Data+Scientist&l=India&start=50
Computer Vision/Artificial Intelligence Architect,Data Scientist,Larsen & Toubro Limited,"Chennai, Tamil Nadu","Strong working knowledge in networking and other data-centre technologies.
Deep understanding of algorithms and workflows, in particular working with visual…",PostedPosted 11 days ago,2023-03-19,"₹5,00,000 - ₹10,00,000",https://in.indeed.com/jobs?q=Data+Scientist&l=India&start=50
Junior Data Scientist - Artificial Intelligence Innovation,Data Scientist,Accenture,"Bengaluru, Karnataka","Designation: Management Level - Senior Analyst.
Years of Experience: 5 to 8 years.
You will be required to utilize the existing frameworks, standards, patterns…",PostedPosted 15 days ago,2023-03-19,NaN,https://in.indeed.com/jobs?q=Data+Scientist&l=India&start=50
Data Science Intern,Data Scientist,Techcovery Solutions,"Bengaluru, Karnataka","Knowledge of Computer Science fundamentals such as object-oriented design, algorithm design, data structures, problem-solving, and complexity analysis.",EmployerActive 3 days ago,2023-03-19,"₹7,000 - ₹15,000 ",https://in.indeed.com/jobs?q=Data+Scientist&l=India&start=50
Lead Data Scientist,Data Scientist,Srijan Technologies PVT LTD,"Gurgaon District, Haryana","Develop robust, scalable and production grade data pipelines and machine learning models to answer key business problems against big, small or huge volumes of…",PostedPosted 30+ days ago,2023-03-19,NaN,https://in.indeed.com/jobs?q=Data+Scientist&l=India&start=60
Data Analyst,Data Scientist,ExpertSource Global Services Pvt. Ltd.,"Navi Mumbai, Maharashtra","Turbhe, Navi Mumbai - 400705, Maharashtra: Reliably commute or planning to relocate before starting work (Required).
Data analysis skills: 1 year (Required).",EmployerActive 1 day ago,2023-03-19,"₹40,000 - ₹65,000 ",https://in.indeed.com/jobs?q=Data+Scientist&l=India&start=60
Data Scientist - Operations Research - Associate,Data Scientist,"JPMorgan Chase Bank, N.A.","Mumbai, Maharashtra","The data science optimization team is supported by the next-gen data science solutions that move us closer to real-time inference, decision making, and…",PostedPosted 2 days ago,2023-03-19,NaN,https://in.indeed.com/jobs?q=Data+Scientist&l=India&start=60
Junior Data Scientist,Data Scientist,Marktine Technology Solutions,Remote,"Responsibilities: Design and develop strong analytics system and predictive models Managing a team of data scientists, machine learning engineers, and big data…",PostedPosted 30+ days ago,2023-03-19,NaN,https://in.indeed.com/jobs?q=Data+Scientist&l=India&start=60
Data Scientist,Data Scientist,Bharat Light & Power,"Bengaluru, Karnataka","Experience with data analysis/Modelling.
Strong Python skills for data wrangling / analysis / visualization / modeling.
Highly skilled at Data Interpretation.",PostedPosted 30+ days ago,2023-03-19,NaN,https://in.indeed.com/jobs?q=Data+Scientist&l=India&start=60
Data Scientist,Data Scientist,Wise Monk,"Gurgaon District, Haryana","Use the sophisticated machine learning and data analytics tools/libraries to realize usable, reliable, and scalable models (machine learning and deep-data…",PostedPosted 30+ days ago,2023-03-19,NaN,https://in.indeed.com/jobs?q=Data+Scientist&l=India&start=60
