Job_title,Job_role,Company,Job_location,Job_summary,Post_date,Today,Job_salary,Job_url
"Software Engineer, AI/Machine Learning",Machine Learning Engineer,Max Secure Software,"Pune, Maharashtra","Experience in machine learning, supervised and unsupervised: Classification, NLP, Decision Trees, Adaptive Decision Algorithms, Neural Networks, Deep Learning…",PostedPosted 11 days ago,2023-03-19,NaN,https://in.indeed.com/jobs?q=Machine+Learning+Engineer&l=India&start=10
Machine Learning Engineer,Machine Learning Engineer,Mercedes-Benz Research and Development India...,"Bengaluru, Karnataka","Develop RESTful APIs to serve machine learning models in production and strong debugging skills.
Enthusiastic self-starter with 4-6+ years industry experience…",PostedPosted 30+ days ago,2023-03-19,NaN,https://in.indeed.com/jobs?q=Machine+Learning+Engineer&l=India&start=10
Data Scientist,Machine Learning Engineer,Bosch Group,"Bengaluru, Karnataka","Proven track record in machine learning, neural networks, pattern analysis, time series forecasting, data analysis as well as data-pipeline technologies (e.g.,…",PostedToday,2023-03-19,NaN,https://in.indeed.com/jobs?q=Machine+Learning+Engineer&l=India&start=10
Machine Learning Engineer,Machine Learning Engineer,Michelin,"Pune, Maharashtra","Responsible for designing , implementation, optimization of end to end AI/ML usecases.
Develop and deploy architectures through product engineering and existing…",PostedPosted 2 days ago,2023-03-19,NaN,https://in.indeed.com/jobs?q=Machine+Learning+Engineer&l=India&start=10
Software Engineer_SAP CPI,Machine Learning Engineer,Telstra,"Bengaluru, Karnataka","As a Software Engineer, you will play a key role in the success of the business capability domain-based organisation model that underpins Telstra’s IT Strategy…",PostedPosted 30+ days ago,2023-03-19,NaN,https://in.indeed.com/jobs?q=Machine+Learning+Engineer&l=India&start=10
Computer Vision Machine Learning Engineer,Machine Learning Engineer,Apple,"Bengaluru, Karnataka","A deep understanding of computer vision, machine learning and deep learning concepts.
Proven ability to implement, improve, debug, and maintain machine learning…",PostedPosted 13 days ago,2023-03-19,NaN,https://in.indeed.com/jobs?q=Machine+Learning+Engineer&l=India&start=10
Deep Learning Engineer,Machine Learning Engineer,Evigway Technologies,"Gurgaon District, Haryana","Research and work on DL models from the ground up, for new use cases, based on set business objectives; Evaluate different Machine Learning algorithms, Analyse…",PostedPosted 30+ days ago,2023-03-19,NaN,https://in.indeed.com/jobs?q=Machine+Learning+Engineer&l=India&start=10
AI/Machine Learning Engineer,Machine Learning Engineer,AssetOne,"Pune, Maharashtra","Deep understanding of statistics and experience with machine learning algorithms/techniques.
Experience is build & deploy machine-learning models at scale on…",PostedPosted 30+ days ago,2023-03-19,NaN,https://in.indeed.com/jobs?q=Machine+Learning+Engineer&l=India&start=20
Senior Engineer: Machine Learning,Machine Learning Engineer,Paxcom India,"Hybrid remote in Gurgaon District, Haryana",PaymentUs leads the North American marketplace in electronic bill payment solutions and have recently signed a partnership with Paypal and Alexa.,PostedPosted 8 days ago,2023-03-19,NaN,https://in.indeed.com/jobs?q=Machine+Learning+Engineer&l=India&start=20
Machine Learning Engineer,Machine Learning Engineer,docquity,India,"1 - 3 Years of Experience.
Develop high-quality software design and architecture.
Develop tools and applications by producing clean,efficient code.",PostedPosted 30+ days ago,2023-03-19,NaN,https://in.indeed.com/jobs?q=Machine+Learning+Engineer&l=India&start=20
Machine Learning Engineer,Machine Learning Engineer,CME Management,"Bengaluru, Karnataka","Design and develop models that use data-mining, machine learning, deep learning, and statistical approaches.
GCP services to develop AI / ML solutions.",PostedPosted 15 days ago,2023-03-19,NaN,https://in.indeed.com/jobs?q=Machine+Learning+Engineer&l=India&start=20
Machine Learning Engineer,Machine Learning Engineer,Samyak Infotech,"Ahmadabad, Gujarat","Designing and programming machine learning methods and integrating them into our ML framework / pipeline.
Knowledge of machine learning libraries Tensorflow,…",PostedPosted 30+ days ago,2023-03-19,NaN,https://in.indeed.com/jobs?q=Machine+Learning+Engineer&l=India&start=20
Battery Energy Storage System Machine Learning Engineer,Machine Learning Engineer,Siemens,"Gurgaon District, Haryana","Full stack/machine learning engineering experience.
Hands-on experience and in-depth knowledge of probabilistic programming, Bayesian learning, optimisation,…",PostedPosted 30+ days ago,2023-03-19,NaN,https://in.indeed.com/jobs?q=Machine+Learning+Engineer&l=India&start=20
Machine learning Engineer,Machine Learning Engineer,Anblicks,"Hyderabad, Telangana","Proficiency with Python and basic libraries for machine learning such as scikit-learn and pandas.
You will lead all the processes from data collection, cleaning…",PostedPosted 30+ days ago,2023-03-19,NaN,https://in.indeed.com/jobs?q=Machine+Learning+Engineer&l=India&start=20
Machine Learning Engineer,Machine Learning Engineer,Aptiv,"Bengaluru, Karnataka",Developing advanced machine learning algorithms for automotive interior (in-cabin) sensing from early prototype to platform integration ready.,PostedPosted 3 days ago,2023-03-19,NaN,https://in.indeed.com/jobs?q=Machine+Learning+Engineer&l=India&start=20
Machine Learning Engineer,Machine Learning Engineer,OptiSol,"Chennai, Tamil Nadu","In depth knowledge of Python and its data analysis and machine learning packages like Scikit Learn, OpenCV, TensorFlow, Keras, PyTorch etc.",PostedPosted 30+ days ago,2023-03-19,"₹6,00,000 - ₹12,00,000",https://in.indeed.com/jobs?q=Machine+Learning+Engineer&l=India&start=20
Machine Learning Engineer,Machine Learning Engineer,INTEGRATED SERVICES,"Remote in Bengaluru, Karnataka","Prior Experience as Machine Learning Engineer or similar role.
Understanding of Data Modelling and Data Structures and software architecture.",EmployerActive 2 days ago,2023-03-19,"₹12,00,000 - ₹30,00,000",https://in.indeed.com/jobs?q=Machine+Learning+Engineer&l=India&start=20
Machine Learning Engineer,Machine Learning Engineer,Mindstix,"Remote in Pune, Maharashtra","Intermediate to advanced knowledge of machine learning, probability theory, statistics, and algorithms.
Work on machine learning based solutions around multiple…",PostedPosted 30+ days ago,2023-03-19,NaN,https://in.indeed.com/jobs?q=Machine+Learning+Engineer&l=India&start=20
Machine Learning Engineer,Machine Learning Engineer,Axiado,"Hyderabad, Telangana","Developing machine learning models for Axiado security products.
Experience in evaluating Machine learning and Neural Net models.",PostedPosted 30+ days ago,2023-03-19,NaN,https://in.indeed.com/jobs?q=Machine+Learning+Engineer&l=India&start=20
Software Engineer_SAP CPI,Machine Learning Engineer,Telstra,"Bengaluru, Karnataka","As a Software Engineer, you will play a key role in the success of the business capability domain-based organisation model that underpins Telstra’s IT Strategy…",PostedPosted 30+ days ago,2023-03-19,NaN,https://in.indeed.com/jobs?q=Machine+Learning+Engineer&l=India&start=20
Machine Learning Engineering Manager - Manufacturing Systems & Infrastructure,Machine Learning Engineer,Apple,"Bengaluru, Karnataka","You will craft, design and implement our machine learning strategy to the iPhone, Mac, iPad supply chains and help build the future of our manufacturing systems…",PostedPosted 8 days ago,2023-03-19,NaN,https://in.indeed.com/jobs?q=Machine+Learning+Engineer&l=India&start=20
Machine Learning Engineer Bengaluru,Machine Learning Engineer,Minna Technologies,"Remote in Bengaluru, Karnataka","Experience building and maintaining scalable machine learning pipelines.
Develop and test machine learning models using best practices and experimental design.",PostedPosted 9 days ago,2023-03-19,NaN,https://in.indeed.com/jobs?q=Machine+Learning+Engineer&l=India&start=20
Machine Learning Engineer,Machine Learning Engineer,Radware,"Bengaluru, Karnataka",Experience in working on billions of newly generated data points per month (many terabytes of data) using cutting-edge Data Science tools.,PostedPosted 30+ days ago,2023-03-19,NaN,https://in.indeed.com/jobs?q=Machine+Learning+Engineer&l=India&start=30
Junior Engineer,Machine Learning Engineer,Eventbrite,+1 locationRemote,". Our technology spans across web, mobile, API, big data, machine learning, search, physical point of sale, and scanning systems.",PostedToday,2023-03-19,NaN,https://in.indeed.com/jobs?q=Machine+Learning+Engineer&l=India&start=30
Applied ML engineer,Machine Learning Engineer,sybill,"Bengaluru, Karnataka","Proficiency in data science and machine learning using Python.
3+ years of experience as an ML engineer, data scientist, CV/NLP researcher, or in a related role…",PostedPosted 30+ days ago,2023-03-19,"₹25,00,000 - ₹55,00,000",https://in.indeed.com/jobs?q=Machine+Learning+Engineer&l=India&start=30
Deep Learning (Medical imaging),Machine Learning Engineer,Livvolta Healthcare Innovations Private Limited,"Remote in Chennai, Tamil Nadu","Expertise in computer vision, AI, machine learning, cloud computing, and deep learning for image processing.
Job Type :* Full-time, 6-month contract (extendable…",PostedPosted 2 days ago,2023-03-19,"From ₹25,000 ",https://in.indeed.com/jobs?q=Machine+Learning+Engineer&l=India&start=30
AI Engineer,Machine Learning Engineer,Helius Technologies,India,"Bachelor's or Master's degree in computer science, artificial intelligence, machine learning, or a related field.
Integrate AI solutions into existing systems.",PostedPosted 25 days ago,2023-03-19,NaN,https://in.indeed.com/jobs?q=Machine+Learning+Engineer&l=India&start=30
Computer Vision Engineer,Machine Learning Engineer,"DIATOZ Solutions Pvt ltd.,","Bengaluru, Karnataka","4.Solid understanding of linear algebra, algorithms, machine learning, optimization, numerical methods.
2.Working closely with leaders to apply AI/ML to create…",PostedPosted 30+ days ago,2023-03-19,"₹7,00,000 - ₹10,00,000",https://in.indeed.com/jobs?q=Machine+Learning+Engineer&l=India&start=30
Machine Learning Engineer,Machine Learning Engineer,Adobe,"Noida, Uttar Pradesh","Strong software development skills that encourage code reuse among engineers and researchers.
Develop algorithms that use deep learning and traditional methods…",PostedPosted 30+ days ago,2023-03-19,NaN,https://in.indeed.com/jobs?q=Machine+Learning+Engineer&l=India&start=30
Machine Learning Engineer 3,Machine Learning Engineer,PayPal,"Hyderabad, Telangana+2 locations","You have knowledge of deep-learning frameworks like Pytorch/Tensorflow.
The person is expected to be highly competent technically and be able to collaborate…",PostedPosted 16 days ago,2023-03-19,NaN,https://in.indeed.com/jobs?q=Machine+Learning+Engineer&l=India&start=30
Machine Learning (AI) Architect,Machine Learning Engineer,Persistent Systems,India,Strong background in industry use cases built on deep learning and machine learning (unsupervised and supervised techniques) is a must.,PostedPosted 14 days ago,2023-03-19,NaN,https://in.indeed.com/jobs?q=Machine+Learning+Engineer&l=India&start=30
Machine Learning Engineer,Machine Learning Engineer,Anantadrishti Technologies,"Lucknow, Uttar Pradesh","Experience in productionizing deep learning systems.
Experience in prototyping deep reinforcement learning and computer vision solutions.",PostedPosted 30+ days ago,2023-03-19,NaN,https://in.indeed.com/jobs?q=Machine+Learning+Engineer&l=India&start=30
Trainee Software Engineer- QA,Machine Learning Engineer,Infrrd,Remote,"A Good Engineering or master’s degree from a reputed university in Computer Science, Information Science or Information Technology (year of graduation-2023)…",PostedPosted 3 days ago,2023-03-19,NaN,https://in.indeed.com/jobs?q=Machine+Learning+Engineer&l=India&start=30
Machine Learning Engineer,Machine Learning Engineer,Apple,"Bengaluru, Karnataka","Intuitive understanding of machine learning algorithms, supervised and unsupervised modeling techniques and their performance characteristics.",PostedPosted 8 days ago,2023-03-19,NaN,https://in.indeed.com/jobs?q=Machine+Learning+Engineer&l=India&start=30
Software Engineer_SAP CPI,Machine Learning Engineer,Telstra,"Bengaluru, Karnataka","As a Software Engineer, you will play a key role in the success of the business capability domain-based organisation model that underpins Telstra’s IT Strategy…",PostedPosted 30+ days ago,2023-03-19,NaN,https://in.indeed.com/jobs?q=Machine+Learning+Engineer&l=India&start=30
Machine Learning Engineer,Machine Learning Engineer,CogniveAI Innovations,"Chennai, Tamil Nadu","4.Demonstrated past algorithm development in at least one area within machine learning like neural networks, clustering, object tracking.",PostedPosted 30+ days ago,2023-03-19,NaN,https://in.indeed.com/jobs?q=Machine+Learning+Engineer&l=India&start=30
Machine Learning Engineer,Machine Learning Engineer,Automotive Robotics,"Chennai, Tamil Nadu",A first-class machine learning engineer will be someone whose expertise translates into the enhanced performance of predictive automation software.,PostedPosted 30+ days ago,2023-03-19,"Up to ₹14,00,000",https://in.indeed.com/jobs?q=Machine+Learning+Engineer&l=India&start=30
Computer Vision Engineer / Scientist,Machine Learning Engineer,Larsen & Toubro Limited,"Chennai, Tamil Nadu","Extensive knowledge on Supervised and Unsupervised learning models.
Experience in Q-Learning / Reinforcement learning is preferable.",PostedPosted 11 days ago,2023-03-19,"₹5,00,000 - ₹10,00,000",https://in.indeed.com/jobs?q=Machine+Learning+Engineer&l=India&start=40
AI Engineer,Machine Learning Engineer,Bobble AI,"Gurgaon District, Haryana","Looking for people who can detect not only signal, but also noise, outliers, and music in their data.
You'd create data sets, extract features, train and deploy…",PostedPosted 30+ days ago,2023-03-19,NaN,https://in.indeed.com/jobs?q=Machine+Learning+Engineer&l=India&start=40
Data Scientist (India Remote),Machine Learning Engineer,Token Metrics,"Remote in Hyderabad, Telangana+1 location",Token Metrics is searching for a highly capable machine learning engineer to optimize our machine learning systems.,PostedPosted 30+ days ago,2023-03-19,NaN,https://in.indeed.com/jobs?q=Machine+Learning+Engineer&l=India&start=40
Software Developer - Machine Learning,Machine Learning Engineer,Contify,"Gurgaon District, Haryana","Experience in setting up supervised & unsupervised learning models,.
Intelligence (MCI) platform to help professionals make informed decisions.",PostedPosted 30+ days ago,2023-03-19,NaN,https://in.indeed.com/jobs?q=Machine+Learning+Engineer&l=India&start=40
AI/ML Engineer,Machine Learning Engineer,Augrade Private Limited,"Temporarily Remote in Mumbai, Maharashtra","Background in computer vision and machine learning.
Proactively identify model failure cases and identify new approaches for improving our machine learning…",PostedPosted 30+ days ago,2023-03-19,"₹8,00,000 - ₹11,00,000",https://in.indeed.com/jobs?q=Machine+Learning+Engineer&l=India&start=40
Machine Learning Engineer,Machine Learning Engineer,Lytx,India,"As our Machine Learning Engineer, you will join our Applied Machine Learning Team in India, who develops machine learning and computer vision algorithms to…",PostedPosted 22 days ago,2023-03-19,NaN,https://in.indeed.com/jobs?q=Machine+Learning+Engineer&l=India&start=40
"ASIC Design Engineer, Machine Learning",Machine Learning Engineer,Google,"Bengaluru, Karnataka","Bachelor's degree in Electrical Engineering or equivalent practical experience.
Experience working with computer architecture / memory subsystem architecture.",PostedPosted 1 day ago,2023-03-19,NaN,https://in.indeed.com/jobs?q=Machine+Learning+Engineer&l=India&start=40
Machine Learning Engineer,Machine Learning Engineer,Pratiti Technologies,"Pune, Maharashtra","Minimum 2 years’ experience with machine learning models and algorithms (linear and non-linear regressions, known and unknown correlations etc.).",PostedPosted 30+ days ago,2023-03-19,NaN,https://in.indeed.com/jobs?q=Machine+Learning+Engineer&l=India&start=40
DevOps Engineer,Machine Learning Engineer,Sophos,India,"Facilitate, manage and communicate information related to environments - their current state, deployed versions and availability to developers, QA engineers and…",PostedPosted 1 day ago,2023-03-19,NaN,https://in.indeed.com/jobs?q=Machine+Learning+Engineer&l=India&start=40
Machine Learning Engineer,Machine Learning Engineer,High Technologies Solutions,"Kalkaji Devi, Delhi","Run machine learning tests and experiments.
Develop machine learning applications according to requirements.
Study and transform data science prototypes.",PostedPosted 30+ days ago,2023-03-19,"₹26,077 - ₹60,943 ",https://in.indeed.com/jobs?q=Machine+Learning+Engineer&l=India&start=40
Computer Vision Engineer,Machine Learning Engineer,i2v systems private limited,"Gurgaon, Gurugram, Haryana","Strong understanding of image processing, computer vision algorithms and machine learning.
High competency with image processing, computer vision and machine…",EmployerActive 2 days ago,2023-03-19,"₹4,00,000 - ₹16,64,443",https://in.indeed.com/jobs?q=Machine+Learning+Engineer&l=India&start=40
Machine Learning Engineer,Machine Learning Engineer,Radome Technologies and services pvt ltd,"Bengaluru, Karnataka","Ø Provide support to engineers and product managers in implementing machine learning in the product.
Ø Research and implement best practices to improve the…",PostedPosted 30+ days ago,2023-03-19,"₹2,00,000 - ₹6,00,000",https://in.indeed.com/jobs?q=Machine+Learning+Engineer&l=India&start=40
Software Engineer_SAP CPI,Machine Learning Engineer,Telstra,"Bengaluru, Karnataka","As a Software Engineer, you will play a key role in the success of the business capability domain-based organisation model that underpins Telstra’s IT Strategy…",PostedPosted 30+ days ago,2023-03-19,NaN,https://in.indeed.com/jobs?q=Machine+Learning+Engineer&l=India&start=40
Engineer Machine Learning,Machine Learning Engineer,Principal Global Services,"Remote in Pune, Maharashtra","Exposure to orchestration of machine learning services.
Familiarity with machine learning frameworks (like TensorFlow, Keras, PyTorch, pyspark) and libraries.",PostedPosted 30+ days ago,2023-03-19,NaN,https://in.indeed.com/jobs?q=Machine+Learning+Engineer&l=India&start=40
Machine Learning Engineer,Machine Learning Engineer,Empiric Infosys,"Surat, Gujarat","Run machine learning tests and experiments.
Develop machine learning applications according to requirements.
Machine learning: 1 year (Preferred).",EmployerActive 2 days ago,2023-03-19,"₹20,000 - ₹30,000 ",https://in.indeed.com/jobs?q=Machine+Learning+Engineer&l=India&start=40
Satellite Image Processing Engineer,Machine Learning Engineer,Digantara,"Bengaluru, Karnataka","The engineer will develop advanced algorithms for accurate detection, tracking and classification of space objects.
Knowledge of data compression techniques.",PostedPosted 9 days ago,2023-03-19,NaN,https://in.indeed.com/jobs?q=Machine+Learning+Engineer&l=India&start=50
ML Engineer I,Machine Learning Engineer,UST,"Thiruvananthapuram, Kerala","Expertise in machine learning model building lifecycle.
Familiar with the machine learning model testing approaches.
Adherence to project schedule / timelines.",PostedPosted 30+ days ago,2023-03-19,NaN,https://in.indeed.com/jobs?q=Machine+Learning+Engineer&l=India&start=50
WorkFusion Machine Learning Engineer,Machine Learning Engineer,UBS,"Pune, Maharashtra","Design, plan and deliver sustainable automated solutions using the latest robotics / machine learning tools.
Analyse business processes to automate them.",PostedPosted 16 days ago,2023-03-19,NaN,https://in.indeed.com/jobs?q=Machine+Learning+Engineer&l=India&start=50
Machine Learning Engineer (Speech),Machine Learning Engineer,Level AI,Remote in India,"Work on problems arising in speech-to-text pipelines, such as transcription, diarization, voice activity detection.",PostedPosted 30+ days ago,2023-03-19,NaN,https://in.indeed.com/jobs?q=Machine+Learning+Engineer&l=India&start=50
Machine Learning Engineer,Machine Learning Engineer,MNJ Software,Remote,"Experience of machine learning Algorithms and Libraries.
Experience with machine learning platforms such as Microsoft Azure, Google Cloud, IBM Watson and Amazon…",PostedPosted 30+ days ago,2023-03-19,NaN,https://in.indeed.com/jobs?q=Machine+Learning+Engineer&l=India&start=50
Machine Learning – Artificial Intelligence,Machine Learning Engineer,Infoobjects,"Jaipur, Rajasthan","3-5 years of experience in the industry with at least 2 years in data science / machine learning.
You’ll implement machine learning algorithms, drive data…",PostedPosted 30+ days ago,2023-03-19,NaN,https://in.indeed.com/jobs?q=Machine+Learning+Engineer&l=India&start=50
Data Engineer,Machine Learning Engineer,IKEA,"Bengaluru, Karnataka",Broad knowledge of digital product development principles and the importance of rapid validated learning cycles to optimise performance long term.,PostedPosted 7 days ago,2023-03-19,NaN,https://in.indeed.com/jobs?q=Machine+Learning+Engineer&l=India&start=50
Machine Learning Engineer,Machine Learning Engineer,MetaMap,"Bengaluru, Karnataka","Ability to train machine learning models, monitor metrics, and set up proper benchmarks.
Train machine learning models, compute metrics, monitor these models…",PostedPosted 30+ days ago,2023-03-19,NaN,https://in.indeed.com/jobs?q=Machine+Learning+Engineer&l=India&start=50
Senior Machine Learning Engineer,Machine Learning Engineer,Wavelabs Technologies,"Hyderabad, Telangana","Machine learning: 5 years (Required).
3+ years of work experience in writing code in Python.
Experience in using various Python libraries like Pandas, NumPy.",EmployerActive 3 days ago,2023-03-19,"₹25,00,000 - ₹35,00,000",https://in.indeed.com/jobs?q=Machine+Learning+Engineer&l=India&start=50
Machine Learning Engineer,Machine Learning Engineer,Brightree,"Bengaluru, Karnataka","You will use the leading-edge technologies in machine learning and cloud computing to train, serve and monitor AI/ML models in production.",PostedPosted 30+ days ago,2023-03-19,NaN,https://in.indeed.com/jobs?q=Machine+Learning+Engineer&l=India&start=50
Data Scientist/Machine Learning Engineer,Machine Learning Engineer,Cogoport,"Mumbai, Maharashtra","Build predictive models using machine-learning algorithms.
Proficiency with python and basic libraries for machine learning like scikit-learn, pandas, numpy.",PostedPosted 23 days ago,2023-03-19,NaN,https://in.indeed.com/jobs?q=Machine+Learning+Engineer&l=India&start=50
Data Analytics / Machine Learning Engineers,Machine Learning Engineer,Tata Elxsi,"Bengaluru, Karnataka","Strong fundamentals in Statistical Analysis and Machine Learning algorithms for regression, classification, clustering, anomaly detection and NLP using…",PostedPosted 25 days ago,2023-03-19,NaN,https://in.indeed.com/jobs?q=Machine+Learning+Engineer&l=India&start=50
Software Engineer_SAP CPI,Machine Learning Engineer,Telstra,"Bengaluru, Karnataka","As a Software Engineer, you will play a key role in the success of the business capability domain-based organisation model that underpins Telstra’s IT Strategy…",PostedPosted 30+ days ago,2023-03-19,NaN,https://in.indeed.com/jobs?q=Machine+Learning+Engineer&l=India&start=50
Senior Machine Learning Engineer,Machine Learning Engineer,PinnacleWorks Infotech,"Gurgaon District, Haryana","Train & tune Automated speech recognition (ASR) models.
Enhance existing models used in production settings.
Ability to read recent ML research papers and adapt…",PostedPosted 30+ days ago,2023-03-19,NaN,https://in.indeed.com/jobs?q=Machine+Learning+Engineer&l=India&start=50
Machine Learning Engineer,Machine Learning Engineer,JForce Solutions,"Vile Parle, Mumbai, Maharashtra",Proficiency in machine learning frameworks (like Keras or PyTorch) and libraries (like scikit-learn or pandas).,PostedPosted 30+ days ago,2023-03-19,NaN,https://in.indeed.com/jobs?q=Machine+Learning+Engineer&l=India&start=50
ML/AI Engineer,Machine Learning Engineer,Quest Global,"Bengaluru, Karnataka","Good to have knowledge about a wide range of classical machine learning algorithms like – Decision Trees, Random Forrest, SVM, SVC, PCA, Polynomial Regression,…",PostedPosted 2 days ago,2023-03-19,NaN,https://in.indeed.com/jobs?q=Machine+Learning+Engineer&l=India&start=60
Manager- Machine Learning Engineer,Machine Learning Engineer,Diageo,"Bengaluru, Karnataka","Extensive knowledge of machine learning evaluation metrics and best practices.
A firm understanding of mathematics (including the role of algorithm theory in…",PostedPosted 30+ days ago,2023-03-19,NaN,https://in.indeed.com/jobs?q=Machine+Learning+Engineer&l=India&start=60
Machine Learning Operations Engineer,Machine Learning Engineer,Corteva Agriscience,"Remote in Hyderabad, Telangana","Any other machine learning operations tool have added advantage.
Should have good handson experience in Python(2+ years).
Total work: 5 years (Preferred).",PostedPosted 30+ days ago,2023-03-19,"₹20,00,000 - ₹28,00,000",https://in.indeed.com/jobs?q=Machine+Learning+Engineer&l=India&start=60
