Job_title,Job_role,Company,Job_location,Job_summary,Post_date,Today,Job_salary,Job_url
AI/ML Engineer,Data Engineer,Pitchvantage llc,Remote,"Collaborate with data scientists, software engineers, and product managers to design and implement machine learning solutions.
Job Types: Full-time, Contract.",PostedJust posted,2023-03-19,"₹20,00,000 - ₹30,00,000",https://in.indeed.com/jobs?q=Data+Engineer&l=India&start=0
iOS Developer,Data Engineer,Nureca Dr. Trust,"Chandigarh, Chandigarh","Good knowledge on concurrency, memory handling & swift fundamentals * Experience with databases like realm & core data.",PostedPosted 3 days ago,2023-03-19,"₹12,00,000 - ₹15,00,000",https://in.indeed.com/jobs?q=Data+Engineer&l=India&start=0
Sr Software Engineer - Data,Data Engineer,Uber,"Bengaluru, Karnataka","Unless formally approved to work fully remotely, Uber expects employees to spend at least half of their work time in their assigned office.",PostedPosted 30+ days ago,2023-03-19,NaN,https://in.indeed.com/jobs?q=Data+Engineer&l=India&start=0
Sr. DevOps Engineer - Observability,Data Engineer,SailPoint,Maharashtra,"Serve as a mentor to junior engineers.
Strong interpersonal and teaming skills - ability to set and enforce process and influence engineers who are not direct…",PostedPosted 30+ days ago,2023-03-19,NaN,https://in.indeed.com/jobs?q=Data+Engineer&l=India&start=0
Integration Software Engineer - AEM,Data Engineer,PathFactory,Remote,"Develop data share between the external data lake and AEM for analytics/reporting.
We’re looking for integration engineers with hands-on experience designing…",PostedPosted 11 days ago,2023-03-19,NaN,https://in.indeed.com/jobs?q=Data+Engineer&l=India&start=0
Senior Software Engineer- Backend,Data Engineer,Eightfold.AI,"Bengaluru, Karnataka+1 location","Design and develop safe and reliable data pipelines for high-scale data integration for fortune 500 customers.
Cares about the details in the user experience.",PostedPosted 4 days ago,2023-03-19,NaN,https://in.indeed.com/jobs?q=Data+Engineer&l=India&start=0
Data & Analytics Lead - X Delivery,Data Engineer,Boston Consulting Group,"New Delhi, Delhi+1 location",You will provide technical support through deeper understanding of relevant data analytics solutions and processes to build high quality and efficient analytic…,PostedPosted 30+ days ago,2023-03-19,NaN,https://in.indeed.com/jobs?q=Data+Engineer&l=India&start=0
Data Engineer_PGET,Data Engineer,Mercedes-Benz Research and Development India...,"Bengaluru, Karnataka","Education: Masters in Computer Science, Electrical / Electronics or Equivalent engineering –.
Excellent Programming skills in Python.",PostedPosted 5 days ago,2023-03-19,NaN,https://in.indeed.com/jobs?q=Data+Engineer&l=India&start=0
"Engineering Manager, Global Payment Processing",Data Engineer,Uber,"Hyderabad, Telangana","Communicate and collaborate within and across teams (both engineers, data scientists / analysts, designers, product, Strategy, Business & Ops teams) to…",PostedPosted 27 days ago,2023-03-19,NaN,https://in.indeed.com/jobs?q=Data+Engineer&l=India&start=0
"Software Engineer, Client Ops",Data Engineer,Boston Consulting Group,"New Delhi, Delhi+1 location",You will provide technical support through deeper understanding of relevant data analytics solutions and processes to build high quality and efficient analytic…,PostedPosted 30+ days ago,2023-03-19,NaN,https://in.indeed.com/jobs?q=Data+Engineer&l=India&start=0
Project Controls Automation Engineer,Data Engineer,Bechtel,"New Delhi, Delhi","Knowledge APIs for data integration with other applications Eg. P6 API.
Telework Type: Full-Time Office/Project.
Understanding of SQL and database query.",PostedPosted 30+ days ago,2023-03-19,NaN,https://in.indeed.com/jobs?q=Data+Engineer&l=India&start=0
Data Engineer,Data Engineer,Global Employees,Remote,"Passion for engineering and computer science around data.
Increase accessibility and effectiveness of data (work with analysts, data scientists, and developers…",EmployerActive 1 day ago,2023-03-19,"₹10,00,000 - ₹30,00,000",https://in.indeed.com/jobs?q=Data+Engineer&l=India&start=0
DATA ANALYST,Data Engineer,Larsen & Toubro Limited,"Chennai, Tamil Nadu","Developing and maintaining databases , data systems – reorganizing data in a readable format.
Performing analysis to assess quality and meaning of data.",PostedPosted 11 days ago,2023-03-19,"₹8,00,000 - ₹12,00,000",https://in.indeed.com/jobs?q=Data+Engineer&l=India&start=0
Azure_Data_Engineer _T8,Data Engineer,Mercedes-Benz Research and Development India...,"Bengaluru, Karnataka","Good knowledge of Spark and Scala.
Good knowledge of ADF and Databricks.
Strong communication and interpersonal skills.
Good knowledge of Spark and Scala.",PostedPosted 30+ days ago,2023-03-19,NaN,https://in.indeed.com/jobs?q=Data+Engineer&l=India&start=0
Data Engineer,Data Engineer,Nineleaps,"Bengaluru, Karnataka","Experience building data processing frameworks, and big data pipelines.
Work with data management team & project leads.
Basic Understanding of Python:- ETL.",PostedPosted 3 days ago,2023-03-19,"₹7,96,296 - ₹21,50,927",https://in.indeed.com/jobs?q=Data+Engineer&l=India&start=0
Azure_Data_Engineer _T8,Data Engineer,Mercedes-Benz Research and Development India...,"Bengaluru, Karnataka","Good knowledge of Spark and Scala.
Good knowledge of ADF and Databricks.
Strong communication and interpersonal skills.
Good knowledge of Spark and Scala.",PostedPosted 30+ days ago,2023-03-19,NaN,https://in.indeed.com/jobs?q=Data+Engineer&l=India&start=10
AWS Data Engineer,Data Engineer,Cloudare Technologies Private Limited,"Remote in Bengaluru, Karnataka","Must to Have Skills : AWS - Data Engineer -* PySpark, Glue, S3, Athena.
To work in the capacity of AWS Cloud developer.
Scripting/programming in Python/Pyspark.",PostedPosted 4 days ago,2023-03-19,"₹10,00,000 - ₹13,00,000",https://in.indeed.com/jobs?q=Data+Engineer&l=India&start=10
AWS Data Engineer,Data Engineer,BugendaiTech,Remote,"Show efficiency in handling data - tracking data lineage, ensuring data quality, and improving discover ability of data.",PostedPosted 4 days ago,2023-03-19,NaN,https://in.indeed.com/jobs?q=Data+Engineer&l=India&start=10
Big Data Engineer,Data Engineer,Albireo Tech System,Remote,"Skills- ETL, aws, sql, kafka, spark, dynamodb.
Time - 30 min to 45 min.
Job Types: Part-time, Freelance.
Part-time hours: 5 per week.",PostedPosted 25 days ago,2023-03-19,"₹1,000 - ₹3,00",https://in.indeed.com/jobs?q=Data+Engineer&l=India&start=10
Data Engineer II,Data Engineer,"ShipBob, Inc.","Remote in New Delhi, Delhi","Focus on growing as DBA in an Azure SQL environment.
Perform SQL programming and performance tuning and optimization.
1-4 years of experience.",PostedPosted 1 day ago,2023-03-19,NaN,https://in.indeed.com/jobs?q=Data+Engineer&l=India&start=10
Data Engineer,Data Engineer,Maximus Human Resources,"Bengaluru, Karnataka","1-2 years of experience in *#data* engineering.
Looking for *#Data* *#Engineer*with *#Python* to Big product based client @ *#Bangalore* *#Hybrid*model with…",PostedPosted 2 days ago,2023-03-19,"₹7,00,000 - ₹10,00,000",https://in.indeed.com/jobs?q=Data+Engineer&l=India&start=10
Data Engineer,Data Engineer,krtrimaiq cognitive solutions,"Bengaluru, Karnataka","Krtrimaiq Cognitive Solutions appears to be a company that offers various cognitive services such as natural language processing, speech recognition, and…",PostedPosted 26 days ago,2023-03-19,"From ₹50,000 ",https://in.indeed.com/jobs?q=Data+Engineer&l=India&start=10
Associate Data Engineer,Data Engineer,Intercontinental Exchange,"Remote in Hyderabad, Telangana","Collaborate with business, data architects and various technology teams on data projects.
Strong data analytical and problem-solving skills.",PostedPosted 1 day ago,2023-03-19,NaN,https://in.indeed.com/jobs?q=Data+Engineer&l=India&start=10
Data engineer Intern,Data Engineer,Truthics Solutions,"Delhi, Delhi","Creating API integrations to extract data from Social Media and CRM APIs using Python 2.
Creating automation using Python 3.",PostedPosted 18 days ago,2023-03-19,NaN,https://in.indeed.com/jobs?q=Data+Engineer&l=India&start=10
Senior Data Engineer,Data Engineer,Mercedes-Benz Research and Development India...,"Bengaluru, Karnataka","Collaborating with data scientists, data analysts, and other stakeholders to understand their data needs and identify opportunities to leverage data to solve…",PostedPosted 30+ days ago,2023-03-19,NaN,https://in.indeed.com/jobs?q=Data+Engineer&l=India&start=10
Data Engineer,Data Engineer,TalentRupt,"Bengaluru, Karnataka","*SQL Database / SQL Scripting skill*.
Ability to perform under pressure.
In this role, you need to analyze and solve increasingly complex problems.",Hiring ongoing,2023-03-19,"₹4,00,000 - ₹18,00,000",https://in.indeed.com/jobs?q=Data+Engineer&l=India&start=10
Data Analyst - Visakhapatnam,Data Engineer,Patra Corporation,"Temporarily Remote in Visakhapatnam, Andhra Pradesh","Research opportunities for data acquisition and new uses for existing data.
Recommend ways to improve data reliability, efficiency and quality (e.g. data…",PostedToday,2023-03-19,NaN,https://in.indeed.com/jobs?q=Data+Engineer&l=India&start=10
SAP PS COSULTANT,Data Engineer,Infosys Limited,"Pune, Maharashtra","Ability to work with clients to identify business challenges and contribute to client deliverables by refining, analyzing, and structuring relevant data •…",PostedPosted 30+ days ago,2023-03-19,NaN,https://in.indeed.com/jobs?q=Data+Engineer&l=India&start=10
SQL Data Engineer,Data Engineer,Smart fusion corporate solution,Remote,"mmediate Hiring!!! Salary : 400000 lak to 1200000 lpa Experience: 2 years to 10 years Contact: 98847 00289 Job Type: Full-time Salary: ₹600,000.00 - ₹1",EmployerActive 1 day ago,2023-03-19,"₹6,00,000 - ₹12,00,000",https://in.indeed.com/jobs?q=Data+Engineer&l=India&start=10
Data Engineer,Data Engineer,Confluent,"Bengaluru, Karnataka","Strong knowledge of data architectures and data modeling and data infrastructure ecosystem.
You will build data pipelines that enable data scientists, analytics…",PostedToday,2023-03-19,NaN,https://in.indeed.com/jobs?q=Data+Engineer&l=India&start=10
Data Engineer,Data Engineer,Recbots,"Bengaluru, Karnataka","Data engineer: 4 years (Preferred).
Experinece in Python, Kafka, Docker.
Excellent in at least one programming language: *Python, R*.",PostedPosted 30 days ago,2023-03-19,"₹10,00,000 - ₹15,00,000",https://in.indeed.com/jobs?q=Data+Engineer&l=India&start=20
Data Engineer,Data Engineer,optimhire,"Bengaluru, Karnataka","Maintain and support data mart, data analytics platforms & application.
Work Experience Data Engineer: 4+ years of experience in data engineering on cloud…",PostedPosted 2 days ago,2023-03-19,"₹8,00,000 - ₹14,00,000",https://in.indeed.com/jobs?q=Data+Engineer&l=India&start=20
Data Analyst/Data Engineer,Data Engineer,The English Channel,"Remote in Ahmedabad, Gujarat","Develop and communicate data extraction approaches for assigned data products of North American government spending data, bid data, contract data, and contacts…",EmployerActive 16 days ago,2023-03-19,"₹6,00,000 - ₹9,00,000",https://in.indeed.com/jobs?q=Data+Engineer&l=India&start=20
Data Engineer,Data Engineer,Mercedes-Benz Research and Development India...,"Bengaluru, Karnataka","Candidate will be responsible for analyzing new data source along with other data scientists.
Knowledge in Azure Big data store.",PostedPosted 30+ days ago,2023-03-19,NaN,https://in.indeed.com/jobs?q=Data+Engineer&l=India&start=20
People Analytics Data Engineer,Data Engineer,Ericsson,"Gurgaon District, Haryana","The Data Architect will support our software developers, other database architects, data analysts and data scientists on data initiatives and will ensure…",PostedPosted 5 days ago,2023-03-19,NaN,https://in.indeed.com/jobs?q=Data+Engineer&l=India&start=20
Data Engineer (Remote),Data Engineer,nClouds,"Remote in Gurgaon District, Haryana","At least 5 years of experience as a data engineer.
Strong understanding of data warehousing and data pipeline design.
Experience with SQL and NoSQL databases.",PostedPosted 25 days ago,2023-03-19,NaN,https://in.indeed.com/jobs?q=Data+Engineer&l=India&start=20
Data engineer (Data Platform),Data Engineer,GIBRALTAR TECHNOLOGIES LLC,"Bengaluru, Karnataka","Experience in relational databases/ data marts/data warehouses and complex SQL programming.
Key Roles and Responsibilities • Develop, understand, and enhance…",PostedPosted 30+ days ago,2023-03-19,"₹5,00,000 ",https://in.indeed.com/jobs?q=Data+Engineer&l=India&start=20
Data Engineer,Data Engineer,Commonwealth Bank,"Bengaluru, Karnataka","We are looking for a data engineer who can gather and analyse technical business requirements in business processes, through requirements elicitation, solutions…",PostedPosted 4 days ago,2023-03-19,NaN,https://in.indeed.com/jobs?q=Data+Engineer&l=India&start=20
Data Engineer,Data Engineer,IKEA,"Bengaluru, Karnataka",Good knowledge of data science and business intelligence products and how they rely on data feeds for their implementation.,PostedPosted 7 days ago,2023-03-19,NaN,https://in.indeed.com/jobs?q=Data+Engineer&l=India&start=20
Data Engineer,Data Engineer,MSD,"Pune, Maharashtra","Work with data governance team and implement data quality checks and maintain data catalogs.
Design, develop and maintain data pipelines to extract data from a…",PostedPosted 15 days ago,2023-03-19,NaN,https://in.indeed.com/jobs?q=Data+Engineer&l=India&start=20
Data Engineer,Data Engineer,Siemens,"Bengaluru, Karnataka+1 location","Build the infrastructure required for optimal extraction, transformation, and loading of data from a wide variety of data sources using AWS ‘big data’…",PostedPosted 30+ days ago,2023-03-19,NaN,https://in.indeed.com/jobs?q=Data+Engineer&l=India&start=20
Data Engineer- O9,Data Engineer,Acies Global,"Remote in Bengaluru, Karnataka","Passion for working with data - data processing, data storage, data visualization, data quality, data infrastructure, security.",EmployerActive 2 days ago,2023-03-19,"₹10,00,000 - ₹20,00,000",https://in.indeed.com/jobs?q=Data+Engineer&l=India&start=20
SAP PS COSULTANT,Data Engineer,Infosys Limited,"Pune, Maharashtra","Ability to work with clients to identify business challenges and contribute to client deliverables by refining, analyzing, and structuring relevant data •…",PostedPosted 30+ days ago,2023-03-19,NaN,https://in.indeed.com/jobs?q=Data+Engineer&l=India&start=20
Senior Data Engineer,Data Engineer,McKinsey & Company,"Gurgaon District, Haryana","4+ years of experience with data modelling and data warehousing concepts.
By leveraging engineering frameworks and best practices, you will design and develop…",PostedPosted 2 days ago,2023-03-19,NaN,https://in.indeed.com/jobs?q=Data+Engineer&l=India&start=20
Data Analytics Engineer for ADAS Development,Data Engineer,Mercedes-Benz Research and Development India...,"Bengaluru, Karnataka","Development of Data Analytics algorithms for gaining insights in ADAS vehicle measurement data.
Development of Data Analytics algorithms for gaining insights in…",PostedPosted 30+ days ago,2023-03-19,NaN,https://in.indeed.com/jobs?q=Data+Engineer&l=India&start=20
Data Engineer II,Data Engineer,McKinsey & Company,"Gurgaon District, Haryana","2+ years of experience with data modelling and data warehousing concepts.
2+ years of implementing data pipelines or data-intensive assets using SQL and Python.",PostedPosted 2 days ago,2023-03-19,NaN,https://in.indeed.com/jobs?q=Data+Engineer&l=India&start=30
(India-Bangalore) Data Engineer,Data Engineer,Wesco,"Bengaluru, Karnataka","This person will work independently or with a team of data engineers on cloud technology products, projects, and initiatives.",PostedPosted 30+ days ago,2023-03-19,NaN,https://in.indeed.com/jobs?q=Data+Engineer&l=India&start=30
Data Engineer II,Data Engineer,Akamai,Temporarily Remote in India,"Culture. We enable data structures to be leveraged together by combining practices, architectural techniques, and tools for ingesting, transforming, combining…",PostedPosted 17 days ago,2023-03-19,NaN,https://in.indeed.com/jobs?q=Data+Engineer&l=India&start=30
AWS DATA ENGINEER,Data Engineer,Employee Hub,"Gurgaon, Haryana",": Hands-on working experience in analyzing source system data and data flows, working with structured and unstructured data.",Hiring ongoing,2023-03-19,"₹26,00,000 - ₹28,00,000",https://in.indeed.com/jobs?q=Data+Engineer&l=India&start=30
Data Engineer (Kirby Corp.),Data Engineer,systems plus,"Pune, Maharashtra","Research new opportunities for data acquisition.
Develop data models for database structures.
Dentify and evaluate current data management technologies.",PostedToday,2023-03-19,NaN,https://in.indeed.com/jobs?q=Data+Engineer&l=India&start=30
Engineer,Data Engineer,Ericsson,"Noida, Uttar Pradesh","They also need to back up, retrieve, maintain, and migrate programs and data.
The Engineer is to take full responsibility of troubleshooting/Configuration/…",PostedToday,2023-03-19,NaN,https://in.indeed.com/jobs?q=Data+Engineer&l=India&start=30
Data Engineer,Data Engineer,Btrnsfrmd Consulting LLC,"Remote in Pune, Maharashtra","Execute data integrity checks, automate manual data manipulation processes for efficiency.
Collaborate with data specialist teams to understand variables, data…",PostedPosted 11 days ago,2023-03-19,"₹4,50,000 - ₹6,00,000",https://in.indeed.com/jobs?q=Data+Engineer&l=India&start=30
Data Engineer (Airflow/Spark),Data Engineer,Mercedes-Benz Research and Development India...,"Bengaluru, Karnataka",Exploratory data analysis for extracting business insights from large volume of data using data science toolkits and statistical packages.,PostedPosted 5 days ago,2023-03-19,NaN,https://in.indeed.com/jobs?q=Data+Engineer&l=India&start=30
Big Data Engineer,Data Engineer,Mercedes-Benz Research and Development India...,"Bengaluru, Karnataka","The development or the customer cars then collect various vehicle, sensor and environment data.
This data is further analysed and the performance of the ADAS…",PostedPosted 30+ days ago,2023-03-19,NaN,https://in.indeed.com/jobs?q=Data+Engineer&l=India&start=30
Data Engineer,Data Engineer,Apps Associates,Delhi,"Hands-on experience in building data solutions for advanced analytics.
Senior resource with anything between 5 to 10 plus years of experience with strong hands…",PostedPosted 3 days ago,2023-03-19,NaN,https://in.indeed.com/jobs?q=Data+Engineer&l=India&start=30
AWS Data Engineer,Data Engineer,GWC Technologies,"Bengaluru, Karnataka","3+ years of experience in Big Data tools such as *Hadoop, Spark, etc.*.
Hands on Experience in Object Oriented or functional programming such as *Scala or Java…",PostedPosted 1 day ago,2023-03-19,"₹7,96,296 - ₹21,50,927",https://in.indeed.com/jobs?q=Data+Engineer&l=India&start=30
Python Backend Engineer,Data Engineer,Ascendeum Pvt Ltd,"Remote in New Delhi, Delhi","Recording data and reporting it to proper parties, such as clients or leadership.
Compile and analyze data, processes, and codes to troubleshoot problems and…",PostedPosted 10 days ago,2023-03-19,"₹8,00,000 - ₹15,00,000",https://in.indeed.com/jobs?q=Data+Engineer&l=India&start=30
Analytics Data Engineer / Data Scientist,Data Engineer,COMPEGENCE,"Bengaluru, Karnataka","Ability to operationalise the data pipeline.
Operationalise 360 degree Analytical data feedback loop.
4 plus Customer Project experience handling large scale…",PostedPosted 30+ days ago,2023-03-19,"₹90,000 - ₹1,50,000 ",https://in.indeed.com/jobs?q=Data+Engineer&l=India&start=30
Data Engineer – Associate,Data Engineer,BIG IT JOBS,India,"Supporting the day to day activities of the data engineering team by extracting, analyzing and presenting data from disparate sources into a form that is…",PostedPosted 30+ days ago,2023-03-19,NaN,https://in.indeed.com/jobs?q=Data+Engineer&l=India&start=30
SAP PS COSULTANT,Data Engineer,Infosys Limited,"Pune, Maharashtra","Ability to work with clients to identify business challenges and contribute to client deliverables by refining, analyzing, and structuring relevant data •…",PostedPosted 30+ days ago,2023-03-19,NaN,https://in.indeed.com/jobs?q=Data+Engineer&l=India&start=30
Frontend Engineer,Data Engineer,Chqbook,"Gurgaon District, Haryana","Chqbook’s custom product programs don’t depend on traditional underwriting principles - we use alternate data and work with credit bureaus, partners and…",PostedPosted 30+ days ago,2023-03-19,NaN,https://in.indeed.com/jobs?q=Data+Engineer&l=India&start=40
XENTRY Retail application Test Engineer,Data Engineer,Mercedes-Benz Research and Development India...,"Bengaluru, Karnataka","Expertise with Validation of Web Based Application & Mobile Application.
Review and analyze client-specific requirements.
Status reporting to management.",PostedPosted 8 days ago,2023-03-19,NaN,https://in.indeed.com/jobs?q=Data+Engineer&l=India&start=40
Engineer,Data Engineer,Ericsson,"Noida, Uttar Pradesh","They also need to back up, retrieve, maintain, and migrate programs and data.
The Engineer is to take full responsibility of troubleshooting/Configuration/…",PostedToday,2023-03-19,NaN,https://in.indeed.com/jobs?q=Data+Engineer&l=India&start=40
Senior Data Engineer,Data Engineer,Mercedes-Benz Research and Development India...,"Bengaluru, Karnataka","Collaborating with data scientists, data analysts, and other stakeholders to understand their data needs and identify opportunities to leverage data to solve…",PostedPosted 30+ days ago,2023-03-19,NaN,https://in.indeed.com/jobs?q=Data+Engineer&l=India&start=40
Senior Data Engineer,Data Engineer,McKinsey & Company,"Gurgaon District, Haryana","4+ years of experience with data modelling and data warehousing concepts.
By leveraging engineering frameworks and best practices, you will design and develop…",PostedPosted 2 days ago,2023-03-19,NaN,https://in.indeed.com/jobs?q=Data+Engineer&l=India&start=40
Sr. Data Engineer,Data Engineer,Lifesight LLC,"Bengaluru, Karnataka","Design and implement data management services for data trust, data compliance, data access, and metadata management in the form of scalable and configurable…",PostedPosted 12 days ago,2023-03-19,"₹20,00,000 - ₹40,00,000",https://in.indeed.com/jobs?q=Data+Engineer&l=India&start=40
Data Engineer,Data Engineer,Targray,"Gurgaon District, Haryana","Developing and maintaining databases, data systems – reorganizing data in a readable format.
Performing analyses to assess quality and meaning of data and…",PostedPosted 8 days ago,2023-03-19,NaN,https://in.indeed.com/jobs?q=Data+Engineer&l=India&start=40
Data Engineer- O9,Data Engineer,Acies Global,"Remote in Bengaluru, Karnataka","Passion for working with data - data processing, data storage, data visualization, data quality, data infrastructure, security.",EmployerActive 2 days ago,2023-03-19,"₹10,00,000 - ₹20,00,000",https://in.indeed.com/jobs?q=Data+Engineer&l=India&start=40
Data Engineer – Associate,Data Engineer,BIG IT JOBS,India,"Supporting the day to day activities of the data engineering team by extracting, analyzing and presenting data from disparate sources into a form that is…",PostedPosted 30+ days ago,2023-03-19,NaN,https://in.indeed.com/jobs?q=Data+Engineer&l=India&start=40
Sr. Data Engineer,Data Engineer,Etech Global Services,"Remote in Gandhinagar, Gujarat","Should able to extract/fetch data from API using Python.
Sounds knowledge in getting data from different types of Storage and APIs source.",PostedPosted 11 days ago,2023-03-19,"Up to ₹11,00,000",https://in.indeed.com/jobs?q=Data+Engineer&l=India&start=40
Data Quality Engineer,Data Engineer,Autodesk,"Bengaluru, Karnataka","Create, maintain, and improve data quality tracking mechanisms that identifies disruptions in data ingestion and processing.",PostedPosted 1 day ago,2023-03-19,NaN,https://in.indeed.com/jobs?q=Data+Engineer&l=India&start=40
Software Engineer,Data Engineer,Futuryze Digital,"Remote in Bengaluru, Karnataka","Communicating key project data to team members and building cohesion among teams.
Analyzing data to effectively coordinate the installation of new systems or…",PostedPosted 1 day ago,2023-03-19,"₹28,00,000 - ₹60,00,000",https://in.indeed.com/jobs?q=Data+Engineer&l=India&start=40
SAP PS COSULTANT,Data Engineer,Infosys Limited,"Pune, Maharashtra","Ability to work with clients to identify business challenges and contribute to client deliverables by refining, analyzing, and structuring relevant data •…",PostedPosted 30+ days ago,2023-03-19,NaN,https://in.indeed.com/jobs?q=Data+Engineer&l=India&start=40
Data Scientist,Data Engineer,Bosch Group,"Bengaluru, Karnataka","Experience: At least 2 years of experience of professional data science.
Proven track record in machine learning, neural networks, pattern analysis, time series…",PostedToday,2023-03-19,NaN,https://in.indeed.com/jobs?q=Data+Engineer&l=India&start=40
Data Warehouse Engineer,Data Engineer,Larsen & Toubro Limited,"Chennai, Tamil Nadu","Ability to profile data, assess data quality in the context of business rules, and incorporate validation and certification mechanisms to ensure data quality.",PostedPosted 11 days ago,2023-03-19,"₹10,00,000 - ₹18,00,000",https://in.indeed.com/jobs?q=Data+Engineer&l=India&start=40
Data Engineer II,Data Engineer,Availity India,India,"Ensure industry best practices around data pipelines, metadata management, data quality, data governance, and data privacy.
3+ years using Apache Spark.",PostedPosted 3 days ago,2023-03-19,NaN,https://in.indeed.com/jobs?q=Data+Engineer&l=India&start=50
