Job_title,Job_role,Company,Job_location,Job_summary,Post_date,Today,Job_salary,Job_url
Walmart Data Analyst,Data Analyst,Kaliber Global,"Bengaluru, Karnataka","He/She must be able to multitask and manage large data sets in Excel with confidence.
The Data Analyst will have a background data analysis, like Sales,…",EmployerActive 4 days ago,2023-03-19,NaN,https://in.indeed.com/jobs?q=Data+Analyst&l=India&start=0
Data Analyst Intern,Data Analyst,Matar Media,"Bengaluru, Karnataka","Identifying relevant data models for Company's operations and Products.
Good Mathematical and logical abilities and a strong understanding of data.",PostedPosted 1 day ago,2023-03-19,"₹5,000 - ₹15,000 ",https://in.indeed.com/jobs?q=Data+Analyst&l=India&start=0
AI / Big Data Analyst (Powertrain applications),Data Analyst,Bosch Group,"Bengaluru, Karnataka",Bachelor of Engineering (B.E / B.,PostedToday,2023-03-19,NaN,https://in.indeed.com/jobs?q=Data+Analyst&l=India&start=0
Intern - Data Analytics,Data Analyst,Waters Corporation,"Bengaluru, Karnataka","Use statistical methods to analyze data and generate useful business reports.
Work with departmental managers to outline the specific data needs for each…",PostedPosted 4 days ago,2023-03-19,NaN,https://in.indeed.com/jobs?q=Data+Analyst&l=India&start=0
Data & Analytics Lead - X Delivery,Data Analyst,Boston Consulting Group,"New Delhi, Delhi+1 location",You will provide technical support through deeper understanding of relevant data analytics solutions and processes to build high quality and efficient analytic…,PostedPosted 30+ days ago,2023-03-19,NaN,https://in.indeed.com/jobs?q=Data+Analyst&l=India&start=0
Data Analyst 3 b,Data Analyst,HP,"Bengaluru, Karnataka","Creates plans, data collection and analysis procedures and data insight visualizations for assigned projects.
Works on problems of diverse complexity and scope.",PostedPosted 7 days ago,2023-03-19,NaN,https://in.indeed.com/jobs?q=Data+Analyst&l=India&start=0
Data Analyst,Data Analyst,LAUNDRYHEAP,"Bengaluru, Karnataka","3+ years of relevant experience interpreting data in a business intelligence, analytics, or data science/data scientist role, including relevant tools,…",PostedPosted 1 day ago,2023-03-19,NaN,https://in.indeed.com/jobs?q=Data+Analyst&l=India&start=10
Intern - Data Analytics (APAC),Data Analyst,Waters Corporation,"Bengaluru, Karnataka",Developing processes and tools to assess the effectiveness and accuracy of new data sources and data gathering techniques.,PostedPosted 15 days ago,2023-03-19,NaN,https://in.indeed.com/jobs?q=Data+Analyst&l=India&start=10
Data Analyst,Data Analyst,Glamyo Health,"Connaught Place, Delhi, Delhi","Job Types: Full-time, Regular / Permanent.",PostedPosted 2 days ago,2023-03-19,"₹40,000 - ₹45,000 ",https://in.indeed.com/jobs?q=Data+Analyst&l=India&start=10
Data Analyst Intern,Data Analyst,Careervira,"Remote in Gurgaon, Haryana","Creating data pipelines to automate the process of transforming and optimizing raw data in the required format.
Scraping data from various sources.",EmployerActive 5 days ago,2023-03-19,"₹1,000 - ₹5,000 ",https://in.indeed.com/jobs?q=Data+Analyst&l=India&start=10
Data Research Analyst,Data Analyst,fluid.live,"Remote in Pune, Maharashtra","Proven working experience as a data analyst or business data analyst.
Acquire data from primary or secondary data sources and maintain databases/data systems.",EmployerActive 11 days ago,2023-03-19,"Up to ₹4,50,000",https://in.indeed.com/jobs?q=Data+Analyst&l=India&start=10
QM : Data Analytics,Data Analyst,Mercedes-Benz Research and Development India...,"Bengaluru, Karnataka","Qlik sense back-end (data part) & front-end (Data visualizations) including Master Dimensions, Master measures, Set analysis expressions (& its significance…",PostedPosted 30+ days ago,2023-03-19,NaN,https://in.indeed.com/jobs?q=Data+Analyst&l=India&start=10
Data Analyst/Data Engineer,Data Analyst,The English Channel,"Remote in Ahmedabad, Gujarat","Develop and communicate data extraction approaches for assigned data products of North American government spending data, bid data, contract data, and contacts…",EmployerActive 16 days ago,2023-03-19,"₹6,00,000 - ₹9,00,000",https://in.indeed.com/jobs?q=Data+Analyst&l=India&start=10
Data Analyst,Data Analyst,Uplers,India,"Using data to analyze and evaluate, transform data and insights into business recommendations, and communicate leanings and recommendations to the business…",PostedPosted 5 days ago,2023-03-19,NaN,https://in.indeed.com/jobs?q=Data+Analyst&l=India&start=10
Quantitative Analyst -BFSI,Data Analyst,Clean Charm,"Mumbai, Maharashtra","Must have strong knowledge of algorithms and data structures.
Understand the working and dynamics of financial markets and trading in Equities, Derivatives,…",PostedPosted 4 days ago,2023-03-19,"₹6,00,000 - ₹12,00,000",https://in.indeed.com/jobs?q=Data+Analyst&l=India&start=10
Data Analyst -3,Data Analyst,BK Talent Lease Consulting,Delhi,"ata Analyst -3 BKTC is looking for young and energetic Data Analysts, freshers and experienced for a leading international Consulting firm to join our",PostedPosted 30+ days ago,2023-03-19,NaN,https://in.indeed.com/jobs?q=Data+Analyst&l=India&start=10
Data Analyst (Content Creator),Data Analyst,Trivium Education Services Pvt. Ltd,"Remote in Delhi, Delhi","At least 3 years’ experience working as a data analyst, data scientist, or other data-f7used role.
Experience setting data analytics project requirements and…",EmployerActive 12 days ago,2023-03-19,"From ₹1,00",https://in.indeed.com/jobs?q=Data+Analyst&l=India&start=10
Data Analyst,Data Analyst,Code Brew Labs,"Chandigarh, Chandigarh","Acquire data from primary or secondary data sources and maintain databases/data systems.
Technical expertiseregarding data models, database design development,…",Hiring ongoing,2023-03-19,"₹10,000 - ₹20,000 ",https://in.indeed.com/jobs?q=Data+Analyst&l=India&start=10
MT/Analyst/APL - AML/KYC,Data Analyst,Escalent,Remote,"Leverage data management systems to track and report team performance.
Access experts across industries for maximum learning opportunities including Weekly…",PostedPosted 16 days ago,2023-03-19,NaN,https://in.indeed.com/jobs?q=Data+Analyst&l=India&start=10
Data & Analytics Lead - X Delivery,Data Analyst,Boston Consulting Group,"New Delhi, Delhi+1 location",You will provide technical support through deeper understanding of relevant data analytics solutions and processes to build high quality and efficient analytic…,PostedPosted 30+ days ago,2023-03-19,NaN,https://in.indeed.com/jobs?q=Data+Analyst&l=India&start=10
Data Analyst,Data Analyst,QJ Consulting Private Limited,"Remote in Kolkata, West Bengal","Use data science concepts to develop intelligent dashboards using Python in Power BI.
Job Types: Full-time, Part-time.
Part-time hours: 25 per week.",EmployerActive 15 days ago,2023-03-19,"₹20,000 - ₹45,000 ",https://in.indeed.com/jobs?q=Data+Analyst&l=India&start=10
Data Analyst,Data Analyst,T&N Business Services,Delhi,"Developing and maintaining databases, data systems.
Developing and maintaining databases, data systems.
Performing analysis to assess quality and meaning of…",PostedPosted 30+ days ago,2023-03-19,"Up to ₹5,50,000",https://in.indeed.com/jobs?q=Data+Analyst&l=India&start=20
Data Analyst,Data Analyst,Alice Blue Financial Service Pvt Ltd,"Bengaluru, Karnataka","Skilled with data analysis, data visualization, and reporting & analytics.
Able to analyze the source data and design solutions.",PostedPosted 30+ days ago,2023-03-19,"₹4,00,000 - ₹8,00,517",https://in.indeed.com/jobs?q=Data+Analyst&l=India&start=20
Data Analyst,Data Analyst,Tzar Industries Pvt Ltd,"Tiruchchirappalli, Tamil Nadu","MIS Reports to allow for smooth operations and easy data maintenance.
O Analyse data source and propose solutions to strategic planning problems on one-time or…",PostedPosted 1 day ago,2023-03-19,"From ₹2,25,372",https://in.indeed.com/jobs?q=Data+Analyst&l=India&start=20
Data Analyst,Data Analyst,Screatives Software Services Private Limited,"Hyderabad, Telangana","Mining data from multiple sources, then reorganizing said data in a format that can be interpreted in the reports.
Collecting and interpreting data.",PostedPosted 1 day ago,2023-03-19,"₹30,00,000",https://in.indeed.com/jobs?q=Data+Analyst&l=India&start=20
Data Analyst - Mapping,Data Analyst,Unify Technologies,"Hyderabad, Telangana",Master's/Bachelor's degree or equivalent in Computer Science related fields.,PostedPosted 5 days ago,2023-03-19,NaN,https://in.indeed.com/jobs?q=Data+Analyst&l=India&start=20
Data Analysis - Associate,Data Analyst,"Fiserv, Inc.","Thane, Maharashtra","Develop, implement and maintain automated solutions for data analysis, data management, and data visualization.
Proven working experience in data analysis.",PostedJust posted,2023-03-19,NaN,https://in.indeed.com/jobs?q=Data+Analyst&l=India&start=20
Data Analyst 2,Data Analyst,PayPal,"Bengaluru, Karnataka","Risk Data Analysts apply their analytical and technical skills into researching data, monitoring and creating logics that stop fraudulent activity on PayPal’s…",PostedPosted 30+ days ago,2023-03-19,NaN,https://in.indeed.com/jobs?q=Data+Analyst&l=India&start=20
Data Analytics Interns,Data Analyst,SmartInternz,"Remote in Hyderabad, Telangana","Participate in data quality assurance and testing to ensure accuracy and completeness of data.
Support the development of data analytics processes and…",PostedPosted 30+ days ago,2023-03-19,"₹60,000 - ₹1,80,000",https://in.indeed.com/jobs?q=Data+Analyst&l=India&start=20
Data Governance Analyst,Data Analyst,Go2,Remote,"Conduct data impact assessments to ensure compliance with data protection regulations.
Create and maintain our data dictionaries, data lineage, and other…",PostedPosted 16 days ago,2023-03-19,"₹90,000 - ₹2,50,000 ",https://in.indeed.com/jobs?q=Data+Analyst&l=India&start=20
"Business Analyst/Data Analyst(Python, Sql,(Onsite )",Data Analyst,Valiance Solutins,"Gurgaon, Haryana","Data analytics tools and techniques.
You should be good at understanding client data needs, the landscape of various heterogeneous data sources, identifying a…",EmployerActive 3 days ago,2023-03-19,"₹10,00,000 - ₹30,00,000",https://in.indeed.com/jobs?q=Data+Analyst&l=India&start=20
AI / Big Data Analyst (Powertrain applications) - COB,Data Analyst,Bosch Group,"Coimbatore, Tamil Nadu",Bachelor of Engineering (B.E / B.,PostedToday,2023-03-19,NaN,https://in.indeed.com/jobs?q=Data+Analyst&l=India&start=20
Data engineering ESG Analyst,Data Analyst,Fincor Management Advisory Services Pvt. Ltd.,"Remote in Chandigarh, Chandigarh","Iii. Data engineering / wrangling for inputting new data into the models.
The hire would form part of the data team responsible for the maintenance and…",PostedPosted 4 days ago,2023-03-19,"₹7,00,000 - ₹11,00,000",https://in.indeed.com/jobs?q=Data+Analyst&l=India&start=20
DATA ANALYST,Data Analyst,GR GLOBAL ACE INVESTMENTS,"Visakhapatnam, Andhra Pradesh","A data analyst is someone who scrutinises information using data analysis tools.
The meaningful results they pull from the raw data help their employers or…",PostedPosted 15 days ago,2023-03-19,"₹2,00,000 - ₹3,00,000",https://in.indeed.com/jobs?q=Data+Analyst&l=India&start=20
Data & Analytics Lead - X Delivery,Data Analyst,Boston Consulting Group,"New Delhi, Delhi+1 location",You will provide technical support through deeper understanding of relevant data analytics solutions and processes to build high quality and efficient analytic…,PostedPosted 30+ days ago,2023-03-19,NaN,https://in.indeed.com/jobs?q=Data+Analyst&l=India&start=20
Data Analyst,Data Analyst,SHC TECH,"Remote in Bengaluru, Karnataka","Strong ability to translate data insights into practical business recommendations - Depending on the specific tribe, squad and purpose, a mix of:",PostedPosted 30+ days ago,2023-03-19,"₹6,00,000 - ₹9,00,000",https://in.indeed.com/jobs?q=Data+Analyst&l=India&start=20
Enterprise Data Operations Asst Analyst,Data Analyst,PepsiCo,"Remote in Hyderabad, Telangana","Knowledge of data profiling and data quality tools is a plus.
Knowledge of data modeling, data warehousing, and ETL/ELT pipelines.",PostedPosted 8 days ago,2023-03-19,NaN,https://in.indeed.com/jobs?q=Data+Analyst&l=India&start=30
M&A Analyst,Data Analyst,Accenture,India,"Leverage data analytics and data visualization techniques to enhance reporting workflow.
Leverage data analytics and data visualization techniques to enhance…",PostedToday,2023-03-19,NaN,https://in.indeed.com/jobs?q=Data+Analyst&l=India&start=30
Data Analyst Intern,Data Analyst,OPK eServices,"Gurgaon District, Haryana","Excellent communication and data presentation skills.
Do data analyses and statistical techniques to develop solutions to get meaningful information of data to…",PostedPosted 30+ days ago,2023-03-19,NaN,https://in.indeed.com/jobs?q=Data+Analyst&l=India&start=30
Data Analyst,Data Analyst,Leegality,Remote,"Set up data driven KPIs, dashboards and reports and strive to create a data driven culture.
Present data in clear and comprehensible form to management and…",PostedPosted 30+ days ago,2023-03-19,NaN,https://in.indeed.com/jobs?q=Data+Analyst&l=India&start=30
Data Analyst-Tech,Data Analyst,Chqbook,"Gurgaon District, Haryana","Compile and analyze data related to business' issues.
Develop clear visualizations to convey complicated data in a straightforward fashion.",PostedPosted 30+ days ago,2023-03-19,NaN,https://in.indeed.com/jobs?q=Data+Analyst&l=India&start=30
Data Analyst,Data Analyst,Airtel India,"Gurugram, Haryana+1 location","Develop, organize, manage and maintain graph, table, slide and document templates that will allow for efficient creation of reports and Dashboards.",PostedPosted 30+ days ago,2023-03-19,NaN,https://in.indeed.com/jobs?q=Data+Analyst&l=India&start=30
Business Analyst - All Levels,Data Analyst,WovV Technologies,Remote,"Experience in analysing data to draw business-relevant conclusions and in data visualization techniques and tools.
Business Analyst - 2-5 years.",PostedPosted 2 days ago,2023-03-19,NaN,https://in.indeed.com/jobs?q=Data+Analyst&l=India&start=30
Data Analyst - 2to5 yrs,Data Analyst,Velocida Private Limited,"Chennai, Tamil Nadu","Experience with SQL and ability to write complex queries Experience in supporting data modeling, ETL development, data warehousing, data pipeline and data lake…",EmployerActive 10 days ago,2023-03-19,"₹9,00,000 - ₹10,00,000",https://in.indeed.com/jobs?q=Data+Analyst&l=India&start=30
Data Analyst,Data Analyst,IntegriChain,"Pune, Maharashtra","Analysis of data and identification of data quality issues.
Ad hoc data investigations/data support activities upon customer request.",PostedPosted 2 days ago,2023-03-19,NaN,https://in.indeed.com/jobs?q=Data+Analyst&l=India&start=30
Data Analyst,Data Analyst,PayU,"Bengaluru, Karnataka","Experience in quantitative or statistical analysis, data mining, predictive or statistical modelling, applied programming, data management, data transformation,…",PostedPosted 30+ days ago,2023-03-19,NaN,https://in.indeed.com/jobs?q=Data+Analyst&l=India&start=30
Data Analyst,Data Analyst,S.K Translines.Pvt.ltd,"Jalgaon, Maharashtra","Developing and maintaining databases, and data systems – reorganizing data in a readable format.
Performing analysis to assess the quality and meaning of data.",PostedPosted 1 day ago,2023-03-19,"From ₹12,000 ",https://in.indeed.com/jobs?q=Data+Analyst&l=India&start=30
Intern-Data Analytics,Data Analyst,Mercedes-Benz Research and Development India...,"Bengaluru, Karnataka","Help with data cleaning, data wrangling and data visualization.
The intern will work closely with our data scientists and analysts to assist in the analysis,…",PostedPosted 30+ days ago,2023-03-19,NaN,https://in.indeed.com/jobs?q=Data+Analyst&l=India&start=30
Data Analyst,Data Analyst,NielsenIQ,"Gurgaon District, Haryana","This role is accountable for activities related to Quality checks (Primary testing of data, Retailer Accreditation) from receipt of the data and data loading…",PostedPosted 1 day ago,2023-03-19,NaN,https://in.indeed.com/jobs?q=Data+Analyst&l=India&start=30
Data & Analytics Lead - X Delivery,Data Analyst,Boston Consulting Group,"New Delhi, Delhi+1 location",You will provide technical support through deeper understanding of relevant data analytics solutions and processes to build high quality and efficient analytic…,PostedPosted 30+ days ago,2023-03-19,NaN,https://in.indeed.com/jobs?q=Data+Analyst&l=India&start=30
Data Science Sr Analyst,Data Analyst,PepsiCo,"Remote in Gurgaon District, Haryana","Show expertise for data at all levels: low-latency, relational, and unstructured data stores; analytical and data lakes; data streaming (consumption/production)…",PostedPosted 30+ days ago,2023-03-19,NaN,https://in.indeed.com/jobs?q=Data+Analyst&l=India&start=30
Risk Analyst,Data Analyst,Business fundamental pvt ltd,"Remote in Indi, Karnataka"," Understand and analyze data to provide insights and develop strategy.
 Coding for fetching and processing data - SQL, Hive, Python.",EmployerActive 6 days ago,2023-03-19,"₹12,00,000 - ₹25,00,000",https://in.indeed.com/jobs?q=Data+Analyst&l=India&start=40
KYC -Client Data Analyst,Data Analyst,"JPMorgan Chase Bank, N.A.","Bengaluru, Karnataka","Review of client data/processes to meet firm wide quality standards.
Collection and verification of confidential client data via publicly available and internal…",PostedPosted 3 days ago,2023-03-19,NaN,https://in.indeed.com/jobs?q=Data+Analyst&l=India&start=40
Data Analyst I,Data Analyst,Signant Health,+1 locationTemporarily Remote,"Experience with standard data mining and data presentation techniques.
Some data entry of data change requests may be required (Change Forms).",PostedPosted 19 days ago,2023-03-19,NaN,https://in.indeed.com/jobs?q=Data+Analyst&l=India&start=40
Operations Analyst,Data Analyst,Ditto,Remote,"Prior experience in operations and MIS/data analysis is preferred (a minimum of 2 years).
And we are starting with Insurance.",PostedPosted 24 days ago,2023-03-19,"₹8,00,000 - ₹12,00,000",https://in.indeed.com/jobs?q=Data+Analyst&l=India&start=40
Business Analyst,Data Analyst,Blupace,Remote,"Relational/Object-oriented data modelling.
Conduct data analysis on enterprise privileged identities, accounts, and accesses.",Hiring ongoing,2023-03-19,"From ₹12,00",https://in.indeed.com/jobs?q=Data+Analyst&l=India&start=40
Data Analyst-Lead,Data Analyst,FedEx Express MEISA,"Bengaluru, Karnataka","Acts as a technical expert on complex and specialist subject(s).
Supports management with the analysis, interpretation and application of complex information,…",PostedPosted 1 day ago,2023-03-19,NaN,https://in.indeed.com/jobs?q=Data+Analyst&l=India&start=40
"Analyst, People Analytics",Data Analyst,Boston Consulting Group,"New Delhi, Delhi","Applying an analytical mindset to propose data-driven solutions.
Hands-on experience of data manipulation tools such as Alteryx, SQL etc.",PostedPosted 18 days ago,2023-03-19,NaN,https://in.indeed.com/jobs?q=Data+Analyst&l=India&start=40
Data Analyst,Data Analyst,enexion energy pvt ltd,"Hybrid remote in Pune, Maharashtra","Daily analyzing the data pattern for our different clients.
Analyzing, processing, and verifying the data.
*Experience: *0 to 6 months.",EmployerActive 2 days ago,2023-03-19,"Up to ₹1,80,000",https://in.indeed.com/jobs?q=Data+Analyst&l=India&start=40
Data Analyst,Data Analyst,AMBC,"Hyderabad, Telangana","Provide support for a range of data cleansing and data modeling activities, as required by the business, using internal and external data sources.",PostedPosted 16 days ago,2023-03-19,NaN,https://in.indeed.com/jobs?q=Data+Analyst&l=India&start=40
Data Analyst,Data Analyst,S&P Global,"Hyderabad, Telangana+1 location","We offer several products to our clients, some of which are but not limited to a live streaming product for real time capture of events, a preliminary copy and…",PostedPosted 4 days ago,2023-03-19,NaN,https://in.indeed.com/jobs?q=Data+Analyst&l=India&start=40
Business Analyst Intern,Data Analyst,Paytm,"Noida, Uttar Pradesh","Strong hold on data, with basic understanding of Excel functions such as Pivot, VLOOKUP, etc. as well as of other digital platforms.",PostedPosted 1 day ago,2023-03-19,NaN,https://in.indeed.com/jobs?q=Data+Analyst&l=India&start=40
Data Analyst,Data Analyst,Mojocare,"Bengaluru, Karnataka","As a data analyst, you will be responsible for compiling actionable insights from data and assisting program, sales and marketing managers build data-driven…",EmployerActive 3 days ago,2023-03-19,"₹10,00,000 - ₹14,00,000",https://in.indeed.com/jobs?q=Data+Analyst&l=India&start=40
Data & Analytics Lead - X Delivery,Data Analyst,Boston Consulting Group,"New Delhi, Delhi+1 location",You will provide technical support through deeper understanding of relevant data analytics solutions and processes to build high quality and efficient analytic…,PostedPosted 30+ days ago,2023-03-19,NaN,https://in.indeed.com/jobs?q=Data+Analyst&l=India&start=40
Analytics Analyst-Data Management,Data Analyst,Accenture,"Bengaluru, Karnataka","ETL(Extract, Transport and Load) - Set of methods and tools to extract data from outside sources, transform it to fit an organization`s business needs and load…",PostedToday,2023-03-19,NaN,https://in.indeed.com/jobs?q=Data+Analyst&l=India&start=40
Business Analyst,Data Analyst,LiveStrong Technologies,"Nashik, Maharashtra","Experience with data analysis and visualization tools such as SQL, Tableau, or Power BI is a plus.
Work time: 9 to 6 pm.
Microsoft Office: 1 year (Required).",PostedPosted 3 days ago,2023-03-19,"₹3,00,000 - ₹5,50,000",https://in.indeed.com/jobs?q=Data+Analyst&l=India&start=40
Data Analyst Associate,Data Analyst,FedEx Express MEISA,"Mumbai, Maharashtra","You would also be very conscious of the importance of sharing knowledge and building other team members in the process.
Basic understanding of Windows Servers.",PostedPosted 30+ days ago,2023-03-19,NaN,https://in.indeed.com/jobs?q=Data+Analyst&l=India&start=50
Data Analyst,Data Analyst,Siemens,"Bengaluru, Karnataka","Ability to use the co-ordinates data to create Maps.
End-to-end experience in designing and deploying data visualizations using Tableau Desktop and Tableau…",PostedPosted 30+ days ago,2023-03-19,NaN,https://in.indeed.com/jobs?q=Data+Analyst&l=India&start=50
Data Analyst,Data Analyst,Koch Business Solutions India,"Bengaluru, Karnataka","Understanding client data and technology landscape.
Hands on experience with data exploration tools and SQL Database.
Work in Celonis process mining software.",PostedPosted 1 day ago,2023-03-19,NaN,https://in.indeed.com/jobs?q=Data+Analyst&l=India&start=50
Business Analyst,Data Analyst,Zapminati Marketing Pvt Ltd,"Noida, Uttar Pradesh","Conducting research and gathering data to support business decisions.
A Business Analyst is responsible for analyzing organizational data and processes to…",PostedPosted 2 days ago,2023-03-19,"₹7,00,000 - ₹10,00,000",https://in.indeed.com/jobs?q=Data+Analyst&l=India&start=50
Business Analyst,Data Analyst,Aptean,"Remote in Bengaluru, Karnataka","Prepare weekly reports, gather data, and provide analysis.
In this role, the Analysis & Reporting Analyst will be part of the Customer Success team to provide…",PostedPosted 1 day ago,2023-03-19,NaN,https://in.indeed.com/jobs?q=Data+Analyst&l=India&start=50
Business Analyst (1 - 5 Years),Data Analyst,Codiant,"Indore, Madhya Pradesh","Create requirement documents, use cases/user scenarios, data and process flow diagrams based on the business need.",PostedPosted 1 day ago,2023-03-19,NaN,https://in.indeed.com/jobs?q=Data+Analyst&l=India&start=50
Data Analyst,Data Analyst,Barclays,"Chennai, Tamil Nadu+1 location","Support Customer Targeting manager to deliver data discovery and participate in data walkthroughs.
Follow team processes to use data manipulation languages,…",PostedPosted 3 days ago,2023-03-19,NaN,https://in.indeed.com/jobs?q=Data+Analyst&l=India&start=50
Data Analyst,Data Analyst,GYPR PVT LTD,"New Delhi, Delhi","Three or more years of experience mining data as a data analyst.
Experience with real data in any domain.
Experience in data visualization and presentation.",EmployerActive 11 days ago,2023-03-19,"₹3,00,000 - ₹6,00,000",https://in.indeed.com/jobs?q=Data+Analyst&l=India&start=50
Data Analyst,Data Analyst,Abacus desk it solutions private limited,"Faridabad, Haryana","Acquire data from primary or secondary data sources and maintain databases/data systems.
Develop and implement databases, data collection systems, data…",PostedPosted 1 day ago,2023-03-19,"₹1,20,000 - ₹5,00,000",https://in.indeed.com/jobs?q=Data+Analyst&l=India&start=50
Analyst - Global Mobility USI Reporting & Analytics (HYD),Data Analyst,Deloitte,"Hyderabad, Telangana","§ Data analysis leveraging multiple data sources and tools including Excel, Salesforce, Tableau, SAP/HRIS.
§ Consultation efforts with various stakeholders to…",PostedPosted 8 days ago,2023-03-19,NaN,https://in.indeed.com/jobs?q=Data+Analyst&l=India&start=50
Data Analytics Intern,Data Analyst,Elegant Auto Retail,"Noida, Uttar Pradesh","Candidate must be good at logical thinking, data co-relation and drilling greater insights.
Candidate must have knowledge about advanced excel, graph plotting,…",PostedPosted 30+ days ago,2023-03-19,NaN,https://in.indeed.com/jobs?q=Data+Analyst&l=India&start=50
